show_id,type,title,director,cast,country,date_added,release_year,rating,duration,genre,description
s109,TV Show,3Below: Tales of Arcadia,NA,"Tatiana Maslany, Diego Luna, Nick Offerman, Nick Frost, Glenn Close, Alon Aboutboul, Hayley Atwell, Darin De Paul, Andy Garcia, Cheryl Hines, Tom Kenny, Chris Obi, Cole Sand, Frank Welker, Steven Yeun",United States,"July 12, 2019",2019,TV-Y7,2 Seasons,"Kids' TV, TV Action & Adventure, TV Sci-Fi & Fantasy","After crash-landing on Earth, two royal teen aliens on the run struggle to blend in with humans as they evade intergalactic bounty hunters."
s112,TV Show,44 Cats,NA,"Sarah Natochenny, Suzy Myers, Simona Berman, Erica Schroeder, Marca Leigh, Scottie Ray, Henry F. Benjamin",Italy,"October 1, 2020",2018,TV-Y7,2 Seasons,Kids' TV,"Paw-esome tales abound when singing furry friends Lampo, Milady, Pilou and Meatball band together."
s114,Movie,48 Christmas Wishes,"Marco Deufemia, Justin G. Dyck","Khiyla Aynne, Noah Dyer, Maya Franzoi, Clara Kushnir, Madeline Leon, Liam MacDonald, Matt Schichter, Ethan Yang, Adam Crew",Canada,"December 20, 2017",2017,TV-G,84 min,"Children & Family Movies, Comedies","When a small town's letters to Santa accidentally go up in smoke, two elves venture out of the North Pole to retrieve every missing wish."
s146,Movie,A 2nd Chance,Clay Glen,"Nina Pearce, Adam Tuominen, Emily Morris, Amy Handley, Carmel Johnson, Alanah Gilbert, Hapi Murphy, Lilly Blacker, Julie Kay Lumasag, Elysia Markou",Australia,"July 1, 2017",2011,PG,95 min,"Children & Family Movies, Dramas, Sports Movies","A gymnast lacks the confidence she needs to reach the top. But with the help of her new coach, she has the chance to win a spot on the national team."
s148,Movie,A Babysitter's Guide to Monster Hunting,Rachel Talalay,"Tamara Smart, Oona Laurence, Tom Felton, Troy Leigh-Anne Johnson, Lynn Masako Cheng, Ty Consiglio, Ian Ho, Indya Moore, Alessio Scalzotto, Tamsen McDonough",United States,"October 15, 2020",2020,TV-PG,99 min,Children & Family Movies,"Recruited by a secret society of babysitters, a high schooler battles the Boogeyman and his monsters when they nab the boy she's watching on Halloween."
s156,Movie,A Champion Heart,David de Vos,"Mandy Grace, David de Vos, Donna Rusch, Devan Key, Isabella Mancuso, Ariana Guido",United States,"April 14, 2020",2018,G,90 min,"Children & Family Movies, Dramas","When a grieving teen must work off her debt to a ranch, she cares for a wounded horse that teaches her more about healing than she expected."
s160,Movie,A Christmas Prince,Alex Zamm,"Rose McIver, Ben Lamb, Alice Krige, Honor Kneafsey",United States,"November 17, 2017",2017,TV-PG,92 min,"Children & Family Movies, Dramas, Romantic Movies",Christmas comes early for an aspiring young journalist when she's sent abroad to get the scoop on a dashing prince who's poised to be king.
s161,Movie,A Christmas Prince: The Royal Baby,John Schultz,"Rose McIver, Ben Lamb, Alice Krige, Honor Kneafsey, Sarah Douglas, Andy Lucas, Raj Bajaj, Richard Ashton, Tahirah Sharif, Joel McVeagh, Theo Devaney, Kevin Shen, Momo Yeung, Crystal Yu, Billy Angel",United States,"December 5, 2019",2019,TV-PG,85 min,"Children & Family Movies, Dramas, Romantic Movies","Christmas brings the ultimate gift to Aldovia: a royal baby. But first, Queen Amber must save her family and kingdom by unwrapping a monarchy mystery."
s162,Movie,A Christmas Prince: The Royal Wedding,John Schultz,"Rose McIver, Ben Lamb, Alice Krige, Simon Dutton, Honor Kneafsey, Sarah Douglas, Theo Devaney, John Guerrasio, Andy Lucas, Raj Bajaj, Richard Ashton, Billy Angel, Tahirah Sharif, Joel McVeagh",United States,"November 30, 2018",2018,TV-PG,93 min,"Children & Family Movies, Dramas, Romantic Movies","A year after helping Richard secure the crown, Amber returns to Aldovia to plan their wedding. But her simple tastes clash with royal protocol."
s164,Movie,A Cinderella Story,Mark Rosman,"Hilary Duff, Chad Michael Murray, Jennifer Coolidge, Dan Byrd, Regina King, Julie Gonzalo, Lin Shaye, Madeline Zima, Andrea Avery, Mary Pat Gleason, Paul Rodriguez, Whip Hubley, Kevin Kilner, Erica Hubbard, Simon Helberg","United States, Canada","January 1, 2020",2004,PG,95 min,"Children & Family Movies, Comedies",Teen Sam meets the boy of her dreams at a dance before returning to toil in her stepmother's diner. Can her lost cell phone bring them together?
s165,Movie,A Cinderella Story: Christmas Wish,Michelle Johnston,"Laura Marano, Gregg Sulkin, Isabella Gomez, Johannah Newmarch, Lillian Doucet-Roche, Chanelle Peloso, Barclay Hope, Garfield Wilson",United States,"December 1, 2019",2019,PG,86 min,"Children & Family Movies, Comedies, Music & Musicals","Despite her vain stepmother and mean stepsisters, an aspiring singer works as an elf at a Christmas tree lot and finds her own holiday miracle."
s168,Movie,A Fairly Odd Summer,Savage Steve Holland,"Drake Bell, Daniella Monet, David Lewis, Susanne Blakeslee, Daran Norris, Scott Baio, Devon Weigel, Ella Anderson, Carter Hastings",United States,"November 2, 2019",2014,TV-Y7,68 min,"Children & Family Movies, Comedies","In this live-action adventure, the gang heads to Hawaii, where Timmy learns the source of all fairy magic is in dangerous hands."
s178,Movie,A Go! Go! Cory Carson Christmas,"Stanley Moore, Alex Woo","Alan C. Lim, Taron C. Hensley, Maisie Benson, Kerry Gudjohnsen, Paul Killam, Smith Foreman, Ann Kendrick, Ella Joy Ballesteros, Neena-Sinaii Simpo, Eli Morse",United States,"November 27, 2020",2020,TV-Y,22 min,Children & Family Movies,"When a familiar-looking stranger crashes in without a memory, Cory helps him remember the magic of Christmas to save the holiday for everyone."
s179,Movie,A Go! Go! Cory Carson Halloween,"Alex Woo, Stanley Moore","Alan C. Lim, Smith Foreman, Maisie Benson, Ann Kendrick, Kerry Gudjohnsen, Paul Killam, Stanley Moore, Tyler Hendrix, Ella Joy Ballesteros, Jimmy Olea",NA,"October 2, 2020",2020,TV-Y,22 min,Children & Family Movies,"Cory, Chrissy and Freddie are on the hunt for king-sized candy bars this Halloween! But are all the treats worth the trek to the spooky side of town?"
s180,Movie,A Go! Go! Cory Carson Summer Camp,"Stanley Moore, Alex Woo","Alan C. Lim, Smith Foreman, Abigail Vibat, Pfifer Chastain, Jim Capobianco, Neena-Sinaii Simpo, Eli Morse, Adelaide Hirasaki, Paul Killam, Kerry Gudjohnsen, Maisie Benson",NA,"August 4, 2020",2020,TV-Y,21 min,Children & Family Movies,"Cory's spending the summer at Camp Friendship with his best friend, Freddie. But jealousy flares when Freddie brings his cousin Rosie along for the ride."
s187,Movie,A Holiday Engagement,Jim Fall,"Bonnie Somerville, Shelley Long, Jordan Bridges, Sam McMurray, Haylie Duff, Sam Horrigan, Carrie Wiita, Chris McKenna, Edi Patterson, Jennifer Elise Cox",United States,"November 4, 2019",2011,TV-G,92 min,"Children & Family Movies, Comedies, Romantic Movies",Hilary's plan to hire a good-looking guy to act as her boyfriend backfires when she brings him home for the holidays to try and fool her family.
s218,Movie,A Princess for Christmas,Michael Damian,"Katie McGrath, Sir Roger Moore, Sam Heughan, Travis Turner, Leilah de Meza, Miles Richardson, Charlotte Salt",United States,"August 28, 2020",2011,TV-PG,91 min,"Children & Family Movies, Dramas, Romantic Movies","At the invitation of a relative, young Jules Daly travels with her niece and nephew to a castle in Europe, where Jules falls for a dashing prince."
s226,TV Show,A Series of Unfortunate Events,NA,"Neil Patrick Harris, Patrick Warburton, Malina Weissman, Louis Hynes, K. Todd Freeman, Joan Cusack, Aasif Mandvi",United States,"January 1, 2019",2019,TV-PG,3 Seasons,"Kids' TV, TV Action & Adventure, TV Comedies","The extraordinary Baudelaire orphans face trials, tribulations and the evil Count Olaf in their fateful quest to unlock long-held family secrets."
s228,Movie,A Shaun the Sheep Movie: Farmageddon,"Richard Phelan, Will Becher","Justin Fletcher, John Sparkes, Amalia Vitale, Kate Harbour, David Holt","United Kingdom, France, Belgium, United States, China","February 14, 2020",2020,G,87 min,"Children & Family Movies, Comedies",Shaun and the flock race to help an adorable alien find her way home after her ship crash-lands near Mossy Bottom Farm and sparks a UFO frenzy.
s234,Movie,A StoryBots Christmas,"Evan Spiridellis, Jeff Gill","Edward Asner, Judy Greer, Erin Fitzgerald, Fred Tatasciore, Jeff Gill, Gregg Spiridellis, Evan Spiridellis, Jim Meskimen, Nate Theis",United States,"December 1, 2017",2017,TV-Y,26 min,"Children & Family Movies, Comedies","Bo thinks her holiday gift-giving isn't good enough, so she heads north to study under Santa Claus – only to find he's missing."
s243,Movie,A Trash Truck Christmas,Eddie Rosas,"Henry Keane, Glen Keane, Lucas Neff, Brian Baumgartner, Jackie Loeb, John DiMaggio",NA,"December 11, 2020",2020,TV-Y,28 min,Children & Family Movies,"When Santa crash-lands in the junkyard on Christmas Eve, Hank, Trash Truck and their animal friends all have a hand in rescuing the holiday for everyone."
s245,Movie,A truthful Mother,Ravishankar Venkateswaran,"Revathi, Roger Narayanan, Sneha Ravishankar, Vidya Shankar, SR Leela",India,"March 31, 2020",2020,TV-Y7,85 min,Children & Family Movies,"Facing a drought, a hungry tiger and a noble cow have an extraordinary encounter in this fable based on a children’s book and a Kannada folk song."
s254,Movie,A Whisker Away,"Junichi Sato, Tomotaka Shibayama","Mirai Shida, Natsuki Hanae, Hiroaki Ogi, Koichi Yamadera, Minako Kotobuki, Susumu Chiba, Ayako Kawasumi, Sayaka Ohara, Daisuke Namikawa",Japan,"June 18, 2020",2020,TV-PG,104 min,"Anime Features, Children & Family Movies, International Movies","A peculiar girl transforms into a cat to catch her crush's attention. But before she realizes it, the line between human and animal starts to blur."
s255,Movie,A Witches' Ball,Justin G. Dyck,"Morgan Neundorf, Karen Slater, Loukia Ioannou, Will Ennis, Renee Stein, Keith Cooper, Paul Mason, Lisa Scenna, Ashley Rogan",Canada,"October 1, 2018",2017,PG,91 min,Children & Family Movies,"Beatrix can't wait to be inducted as a witch, but an unfortunate incident threatens to take her pending title away if she doesn't act fast."
s256,Movie,A Wrinkle in Time,Ava DuVernay,"Storm Reid, Oprah Winfrey, Reese Witherspoon, Mindy Kaling, Deric McCabe, Levi Miller, Chris Pine, Gugu Mbatha-Raw, Zach Galifianakis, Michael Peña, Bellamy Young, André Holland, Will McCormack, Rowan Blanchard, Daniel MacPherson",United States,"September 25, 2018",2018,PG,110 min,Children & Family Movies,"Years after their father disappears, Meg and her younger brother Charles Wallace cross galaxies on a quest to save him from the heart of darkness."
s263,Movie,A.X.L.,Oliver Daly,"Alex Neustaedter, Becky G., Alex MacNicoll, Dominic Rains, Thomas Jane, Lou Taylor Pucci, Patricia De Leon, Niko Guardado, Ted McGinley, Marie-Françoise Theodore, Eric Etebari, Dorian Kingi",United States,"March 20, 2019",2018,PG,99 min,"Action & Adventure, Children & Family Movies, Independent Movies","Young motocross racer Miles Hill helps a top-secret robotic combat dog evade its ruthless creator and the military, who are in hot pursuit."
s277,TV Show,Abby Hatcher,Kyran Kelly,"Macy Drouin, Wyatt White, Paul Sun-Hyung Lee, Michela Luci, Christian Dal Dosso, Laaibah Alvi, Leo Orgil","United States, Canada","July 1, 2020",2019,TV-Y,1 Season,Kids' TV,"A big-hearted girl helps her Fuzzly friends who live in her family's hotel with exploring feelings, fixing mishaps and embracing their special quirks."
s286,Movie,Abominable Christmas,Chad Van De Keere,"Isabella Acres, Drake Bell, Emilio Estevez, Nolan Gould, Matthew Lillard, Ray Liotta, Jane Lynch, Ariel Winter",United States,"February 18, 2016",2012,TV-Y7,44 min,"Children & Family Movies, Comedies",Two small abominable snowmen flee their mountain to escape a scientist who's trying to capture them and end up spending Christmas with a human family.
s301,Movie,Action Replayy,Vipul Amrutlal Shah,"Akshay Kumar, Aishwarya Rai Bachchan, Om Puri, Kiron Kher, Neha Dhupia, Rannvijay Singh, Aditya Roy Kapur, Sudeepa Singh, Randhir Kapoor, Rajpal Yadav",India,"May 11, 2020",2010,TV-PG,129 min,"Children & Family Movies, Comedies, International Movies","Sick of his parents’ constant squabbling, a young man travels back in time to the onset of their romance, with plans to set them up for marital bliss."
s365,TV Show,Akbar Birbal,NA,"Kiku Sharda, Vishal Kotian, Delnaaz Irani",India,"March 31, 2020",2019,TV-G,1 Season,"Kids' TV, TV Comedies, TV Dramas","From battles of wit to fights for justice, Emperor Akbar and his trusty advisor Birbal display their unique bond through adventures in Mughal-era India."
s375,Movie,Albion: The Enchanted Stallion,Castille Landon,"Daniel Sharman, Jennifer Morrison, Debra Messing, Stephen Dorff, John Cleese, Liam McIntyre, Richard Kind, Avery Arendes, Castille Landon","United States, Bulgaria","July 1, 2017",2016,TV-PG,106 min,Children & Family Movies,"After a magical horse transports her to a fantasy world ruled by an evil general, a brave girl sets out to save the land once and for all."
s381,TV Show,Alexa & Katie,NA,"Paris Berelc, Isabel May, Tiffani Thiessen, Emery Kelly, Jolie Jenkins, Kerri Medders, Finn Carr, Eddie Shin",United States,"June 13, 2020",2020,TV-G,4 Seasons,"Kids' TV, TV Comedies","Alexa is battling cancer. But with her best friend, Katie, by her side, she's also starting high school – and ready for whatever comes next."
s397,TV Show,Alien TV,NA,"Rob Tinkler, Julie Lemieux, John Cleland, Kyle Dooley, Rupert Degas",NA,"August 21, 2020",2020,TV-Y7,1 Season,"Kids' TV, TV Comedies","Alien reporters Ixbee, Pixbee and Squee travel to a lovely but odd planet called Earth, where they attempt to make sense of humans and their hobbies."
s400,Movie,Alien Xmas,Stephen Chiodo,"Keythe Farley, Dee Bradley Baker, Kaliayh Rhambo, Michelle Deco, Barbara Goodson",United States,"November 20, 2020",2020,TV-Y,42 min,Children & Family Movies,"A young elf mistakes a tiny alien for a Christmas gift, not knowing her new plaything has plans to destroy Earth's gravity — and steal all the presents."
s401,Movie,Aliens Ate My Homework,Sean McNamara,"William Shatner, Dan Payne, Kirsten Robek, Ty Consiglio, Sean McNamara, Christian Convery, Jayden Greig, Lauren McNamara, Alex Zahara, Sandy Robson",United States,"March 6, 2018",2018,PG,90 min,"Children & Family Movies, Comedies, Sci-Fi & Fantasy",Tiny alien lawmen fly into Rod's bedroom and recruit him into helping them stop an intergalactic criminal – who's disguised as a very familiar human.
s409,Movie,All Dogs Go to Heaven,"Don Bluth, Gary Goldman, Dan Kuenster","Dom DeLuise, Burt Reynolds, Daryl Gilley, Candy Devine, Charles Nelson Reilly, Vic Tayback, Melba Moore, Judith Barsi, Rob Fuller, Earleen Carey, Anna Manahan, Nigel Pegram, Loni Anderson, Ken Page, Godfrey Quigley","Ireland, United Kingdom, United States","June 1, 2020",1989,G,85 min,Children & Family Movies,"When a canine con artist becomes an angel, he sneaks back to Earth and crosses paths with an orphan girl who can speak to animals."
s412,TV Show,All Hail King Julien,NA,"Danny Jacobs, Andy Richter, Henry Winkler, Kevin Michael Richardson, India de Beaufort, Jeff Bennett, David Krumholtz, Diedrich Bader, Debra Wilson, Sarah Thyre, Betsy Sodaro",United States,"December 1, 2017",2017,TV-Y7,5 Seasons,"Kids' TV, TV Comedies","In this Emmy winner for Outstanding Children's Animated Program, Madagascar booty-shaker King Julien takes on the jungle’s craziest adventures."
s413,TV Show,All Hail King Julien: Exiled,NA,"Danny Jacobs, Andy Richter, Kevin Michael Richardson, India de Beaufort, Jeff Bennett, Maurice LaMarche",NA,"May 12, 2017",2017,TV-Y7,1 Season,"Kids' TV, TV Action & Adventure, TV Comedies","Julien's been dethroned, but loyal friends and some very unlikely allies will propel the lovable lemur on a colorful journey to take back his kingdom."
s414,Movie,All Hallows' Eve,Charlie Vaughn,"Lexi Giovagnoli, Ashley Argota, John DeLuca, Diane Salinger, Martin Klebba, Tracey Gold, Dee Wallace, Pilot Paisley-Rose, Daniel Cooksley, Vincent Giovagnoli, Dillon Cavitt",United States,"August 1, 2017",2016,TV-G,92 min,"Children & Family Movies, Independent Movies","Instead of summoning the spirit of her dearly departed mother, a charming teen accidentally awakens a vengeful witch who wants to destroy her town."
s433,Movie,Alpha and Omega 2: A Howl-iday Adventure,Richard Rich,"Ben Diskin, Kate Higgins, Blackie Rose, Lindsay Torrance, Liza West, Tracy Pfau, Bill Lader, Meryl Leigh, Shaun Gerardo",United States,"October 1, 2019",2013,TV-G,45 min,Children & Family Movies,"In this animated outdoor adventure, wolf couple Humphrey and Kate face a crisis when one of their three cubs disappears without explanation."
s434,Movie,Alpha and Omega: The Legend of the Saw Tooth Cave,Richard Rich,"Debi Derryberry, Ben Diskin, Kate Higgins, Lindsay Torrance, Larry Thomas, Bill Lader, Cindy Robinson","United States, India","January 1, 2020",2014,TV-Y7,45 min,Children & Family Movies,"When a wolf pup named Runt sneaks off to explore a mysterious cave, he meets and befriends a wolf driven from her pack because she's blind."
s435,TV Show,Alphablocks,NA,"Teresa Gallagher, David Holt, Lizzie Waterworth",United Kingdom,"May 25, 2020",2014,TV-Y,5 Seasons,Kids' TV,"The letters of the alphabet come to life in Alphaland as they read, write and spell their way into an exciting world of phonic fun."
s486,Movie,An American Tail,Don Bluth,"Erica Yohn, Nehemiah Persoff, Amy Green, Phillip Glasser, Christopher Plummer, John Finnegan, Will Ryan, Hal Smith, Dom DeLuise, Madeline Kahn",United States,"April 1, 2018",1986,G,80 min,Children & Family Movies,"Fievel, a young Russian mouse, immigrates to America and must make his own way in the strange and sometimes perilous new world."
s487,Movie,An American Tail: Fievel Goes West,"Phil Nibbelink, Simon Wells","Philip Glasser, James Stewart, Erica Yohn, Cathy Cavadini, Nehemiah Persoff, Dom DeLuise, Amy Irving, John Cleese, Jon Lovitz",United States,"April 1, 2018",1991,G,75 min,Children & Family Movies,"Fievel and his family head west for what turns out to be a wild adventure. Deep in cowboy country, the intrepid mouse faces down a nasty feline."
s488,Movie,An American Tail: The Mystery of the Night Monster,Larry Latham,"Thomas Dekker, Lacey Chabert, Jane Singer, Nehemiah Persoff, Susan Boyd, Robert Hays, Pat Musick, Dom DeLuise, Candi Milo, Jeff Bennett",United States,"April 1, 2018",1999,G,75 min,Children & Family Movies,"When a monster goes on a mouse-napping spree in New York, Fievel and his friends help a reporter get to the bottom of the mystery."
s489,Movie,An American Tail: The Treasures of Manhattan Island,Larry Latham,"Thomas Dekker, Dom DeLuise, Pat Musick, Nehemiah Persoff, Erica Yohn, Lacey Chabert, Elaine Bilstad, Rene Auberjonois, David Carradine, Sherman Howard, Tony Jay, Richard Karron, John Kassir, Ron Perlman",United States,"April 1, 2018",2000,G,79 min,Children & Family Movies,"When Fievel and friends go hunting for buried treasure beneath the ruins of an old subway tunnel, they stumble onto something surprising."
s520,Movie,Angela's Christmas,Damien O’Connor,"Lucy O'Connell, Ruth Negga, Brendan Mullins, Malachy McCourt, Vivian Drew, Anya O'Connor, Janet Moran, Brian Gleeson, Pat Kinevane","Ireland, Canada","November 30, 2018",2018,TV-Y,30 min,Children & Family Movies,A trip to church with her family on Christmas Eve gives young Angela an extraordinary idea. A heartwarming tale based on a story by Frank McCourt.
s521,Movie,Angela's Christmas Wish,Damien O’Connor,"Lucy O'Connell, Brendan Mullins, Ruth Negga, Lola Metcalfe, Jared Harris, Moe Dunford, Oscar Butler, Shona Hamill, Pat Kinevane, Janet Moran, Anya O'Connor",United States,"December 1, 2020",2020,TV-Y,48 min,Children & Family Movies,"With her father working far away in Australia, a determined Angela makes a plan — and a heartfelt wish — to reunite her family in time for the holidays."
s524,TV Show,Angry Birds,NA,"Antti Pääkkönen, Heljä Heikkinen, Lynne Guaglione, Pasi Ruohonen, Rauno Ahonen",Finland,"March 16, 2019",2018,TV-Y7,3 Seasons,"Kids' TV, TV Comedies","Birds Red, Chuck and their feathered friends have lots of adventures while guarding eggs in their nest that pesky pigs keep trying to steal."
s529,Movie,Animal Crackers,"Tony Bancroft, Scott Christian Sava","Emily Blunt, John Krasinski, Ian McKellen, Danny DeVito, Raven-Symoné, Patrick Warburton, Wallace Shawn, Gilbert Gottfried, Tara Strong, Harvey Fierstein, James Arnold Taylor, Kevin Grevioux, Sylvester Stallone, Lydia Rose Taylor","China, Spain, South Korea, United States","July 24, 2020",2020,TV-Y7,106 min,"Children & Family Movies, Comedies","Enchanted animal crackers turn Owen into whatever shape he eats! But to save the family circus, he'll have to keep them out of his evil uncle's hands."
s539,Movie,Annabelle Hooper and the Ghosts of Nantucket,Paul Serafini,"Bailee Madison, Robert Capron, Rachel Resheff, Mavrick Moreno, Whitney Goin, Gary Weeks, Juliana Harkavy, Kevin B. McGlynn, Jamison Stern, Mia Matthews, Bianca Matthews",United States,"August 1, 2017",2016,TV-PG,92 min,Children & Family Movies,"While vacationing on picturesque Nantucket, a crafty teenage mystery writer contends with two thieves as she tries to solve a ghostly conundrum."
s549,Movie,Antariksha Ke Rakhwale,Anirban Majumder,"Sonal Kaushal, Rupa Bhimani, Julie Tejwani, Sabina Malik, Jigna Bharadhwaj, Rajesh Kawa",NA,"June 18, 2019",2018,TV-Y7,65 min,Children & Family Movies,Space villains have abducted all the superheroes! It’s up to Bheem and his trusty team to save the others.
s557,TV Show,忍者ハットリくん,NA,NA,Japan,"December 23, 2018",2012,TV-Y7,2 Seasons,"Anime Series, Kids' TV","Hailing from the mountains of Iga, Kanzo Hattori moves in with elementary school student Kenichi Mitsuba and his family to hone his skills as a ninja."
s571,TV Show,Archibald's Next Big Thing,NA,"Tony Hale, Rosamund Pike, Jordan Fisher, Chelsea Kane, Adam Pally, Kari Wahlgren",NA,"March 20, 2020",2020,TV-Y7,2 Seasons,"Kids' TV, TV Comedies","Happy-go-lucky chicken Archibald may not remember to do his chores, but he never forgets to have fun. After all, life's an adventure!"
s572,Movie,Arctic Dogs,Aaron Woodley,"Jeremy Renner, Heidi Klum, James Franco, John Cleese, Omar Sy, Michael Madsen, Laurie Holden, Anjelica Huston, Alec Baldwin, Donny Falsetti","India, United Kingdom, China, Canada, Japan, South Korea, United States","May 4, 2020",2019,PG,93 min,"Children & Family Movies, Comedies","When he stumbles upon evil Otto Von Walrus's scheme to melt the Arctic, ambitious delivery fox Swifty assembles a ragtag crew to protect the planet."
s589,Movie,Arthur Christmas,Sarah Smith,"James McAvoy, Hugh Laurie, Bill Nighy, Jim Broadbent, Imelda Staunton, Ashley Jensen, Ramona Marquez, Marc Wootton, Laura Linney, Eva Longoria, Michael Palin, Joan Cusack, Deborah Findlay, Rich Fulcher, Sarah Smith, Clint Dyer, Kerry Shale, Stewart Lee, Bronagh Gallagher, Kevin Cecil, Alistair McGowan, David Menkin, Kris Pearn, Ian Ashpitel, Rich Hall, Seeta Indrani, Jane Horrocks, Peter Baynham, Emma Kennedy, Dominic West, Jerry Lambert, Julia Davis, Robbie Coltrane, Iain McKee, Sanjeev Bhaskar, Andy Serkis, Tamsin Greig, Rhys Darby, Seamus Malone, Cody Cameron, David Schneider, Kevin Eldon, Danny John-Jules, Brian Cummings","United Kingdom, United States","January 1, 2020",2011,PG,98 min,"Children & Family Movies, Comedies","At Santa Claus's super-secret toy-making facility, Mr. Claus entrusts his son, Arthur, to carry out an ultra-important Christmas mission."
s599,TV Show,Ask the StoryBots,NA,"Judy Greer, Erin Fitzgerald, Fred Tatasciore, Jeff Gill, Gregg Spiridellis, Evan Spiridellis",United States,"August 2, 2019",2019,TV-Y,3 Seasons,Kids' TV,"Five curious little creatures track down the answers to kids' biggest questions, like how night happens or why we need to brush our teeth."
s616,TV Show,Atomic Puppet,NA,"Eric Bauza, Lisa Norton, Carlos Díaz, Peter Oldring, Heather Bambrick, Rick Miller, Rob Tinkler, Kristina Nicoll","Canada, France","December 1, 2017",2016,TV-Y7,1 Season,"Crime TV Shows, Kids' TV, TV Comedies","Captain Atomic – once a superhero, now a sock puppet – can only activate his powers with the help of Joey, his new partner and biggest fan."
s633,TV Show,Avatar: The Last Airbender,NA,"Zach Tyler, Mae Whitman, Jack De Sena, Dee Bradley Baker, Dante Basco, Jessie Flower, Mako Iwamatsu",United States,"May 15, 2020",2007,TV-Y7,3 Seasons,"Classic & Cult TV, Kids' TV, TV Action & Adventure","Siblings Katara and Sokka wake young Aang from a long hibernation and learn he's an Avatar, whose air-bending powers can defeat the evil Fire Nation."
s676,Movie,Back of the Net,Louise Alston,"Sofia Wylie, Tiarnie Coupland, Trae Robin, Gemma Chua-Tran, Ashleigh Ross, Yasmin Honeychurch, Raj Labade, Christopher Kirby, Melissa Bonne, Kate Box",Australia,"December 21, 2019",2019,TV-Y,86 min,"Children & Family Movies, Sports Movies",An American science geek ready to spend a summer at sea accidentally ends up at an Australian soccer academy and is forced to kick it with the locals.
s705,TV Show,Bakugan: Armored Alliance,NA,NA,NA,"November 6, 2020",2020,TV-Y7,1 Season,"Anime Series, Kids' TV","Dan Kouzo and his crew of heroic brawlers battle both challengers and powerful, evil forces as they work to protect humans and the Bakugan."
s706,TV Show,Bakugan: Battle Planet,NA,"Jonah Wineberg, Deven Christian Mack, Margarita Valderrama, Ticoon Kim, Jason Deline, Will Bowes","Japan, Canada, United States","November 6, 2020",2018,TV-PG,1 Season,"Anime Series, Kids' TV",Dan Kouzo and his pals bond with mysterious creatures known as Bakugan while fighting sinister forces out to control the world.
