show_id,type,title,director,cast,country,date_added,release_year,rating,duration,genre,description
s5191,TV Show,Rhyme Time Town,NA,"Luke Amis, Annabelle Westenholz-Smith, Maddie Evans, Jude Muir",NA,"June 19, 2020",2020,TV-Y,1 Season,Kids' TV,Fun-loving friends Daisy and Cole use music and imagination to solve problems in a town filled with nursery rhyme characters.
s5192,TV Show,Rhyme Time Town Singalongs,NA,"Luke Amis, Annabelle Westenholz-Smith, Maddie Evans, Jude Muir, Hannah Jane Fox, Rhashan Stone",United States,"December 22, 2020",2020,TV-Y,1 Season,Kids' TV,"Love snackable, snap-worthy songs? Sing along with the Rhyme Time Town friends as they use their imaginations and flex their problem-solving skills!"
s5202,TV Show,Richie Rich,NA,"Jake Brennan, Joshua Carlon, Lauren Taylor, Jenna Ortega, Kiff VandenHeuvel, Brooke Wexler",United States,"May 22, 2015",2015,TV-G,2 Seasons,"Kids' TV, TV Comedies","After turning his veggies into green energy, Richie Rich earns a trillion dollars overnight and a new life filled with nonstop fun and adventure."
s5204,Movie,Ride Like a Girl,Rachel Griffiths,"Teresa Palmer, Sam Neill, Sullivan Stapleton, Stevie Payne, Brooke Satchwell, Magda Szubanski, Aaron Glenane, Damien Garvey, Sophia Crawford, Henry Nixon",Australia,"June 27, 2020",2020,PG,99 min,"Children & Family Movies, Dramas, Independent Movies","The daughter of a horse trainer, an ambitious girl sets her sights on becoming the first female jockey to win the Melbourne Cup. Based on a true story."
s5206,Movie,Riding Faith,Paco Aguilar,"John Schneider, T.C. Stallings, Grace Van Dien, Marisa Brown, Jimmy Deshler",United States,"June 17, 2020",2020,TV-PG,81 min,"Children & Family Movies, Dramas, Faith & Spirituality","Following her father's death, a young woman struggles to help her mother keep the family ranch afloat while preserving a special bond with her horse."
s5211,TV Show,Rimba Racer,NA,"Steven Tan, Iain McNally, Chi-Ren Choong, Kevin Adrian Barnaby, Tikriti Shabudin, Sherilyn Pang Li Ching, Azman Zulkiply",Malaysia,"April 5, 2019",2017,TV-PG,1 Season,Kids' TV,"In this animated action series, a rookie driver seeks glory in a world-class auto race, but he’ll need more than just his talent behind the wheel."
s5214,Movie,Rip Tide,Rhiannon Bannenberg,"Debby Ryan, Genevieve Hegney, Andrew Creer, Naomi Sequeira, Aaron Jeffery, Valerie Bader, Jeremy Lindsay Taylor, Danielle Carter, Marcus Graham, Kimie Tsukakoshi","Australia, United Arab Emirates","January 15, 2018",2017,TV-PG,87 min,"Children & Family Movies, Dramas, Sports Movies","Following an embarrassing viral video, a New York model decides to escape from her suffocating existence by visiting her faraway aunt in Australia."
s5237,TV Show,Robocar Poli,NA,"Donald Reignoux, Alexis Tomassian, Thomas Sagols, Pierre Francois Pistori, Bruno Magne, Catherine Desplaces, Fily Keita, Adeline Chetail, Bertrand Liebert, Christophe Lemoine",South Korea,"September 1, 2017",2015,TV-Y,4 Seasons,"Kids' TV, Korean TV Shows","When disaster strikes in Brooms Town, police car Robocar Poli, fire truck Robotruck Roy and their friends on the rescue team race to save the day."
s5238,TV Show,Robot Trains,NA,"Bill Rogers, Carrie Savage, Ken Spassione, Angela Mulligan, Mark Szabo, Daniel J. Edwards, Mike Pollock, Anthony Salerno",South Korea,"December 31, 2019",2018,TV-Y7,2 Seasons,"Kids' TV, Korean TV Shows","Keeping peace and safety in Train World is no easy task, but for five trains with the power to transform into robots, every crisis is an adventure!"
s5240,TV Show,Robozuna,NA,"Taylor Clarke-Hill, Tom Clarke-Hill, Larissa Murray, Brianna Price, Michael Obiora, Morwenna Banks, Rufus Jones, Duncan Wisbey, Danny John-Jules, Ali A",United Kingdom,"March 15, 2019",2018,TV-Y7,2 Seasons,"British TV Shows, Kids' TV",A boy and his homemade robot enter the toughest competition in the universe while attempting to free their oppressed home from an evil empire.
s5242,Movie,Rock My Heart,Hanno Olderdissen,"Lena Klenke, Dieter Hallervorden, Emilio Sakraya, Annette Frier, Milan Peschel, Vedat Erincin, Johann von Bülow, Michael Lott, Hans Martin Stier, Anneke Kim Sarnau",Germany,"June 7, 2019",2019,TV-PG,110 min,"Children & Family Movies, Dramas, International Movies","After an adventurous teen with a heart defect bonds with an unruly stallion, she trains to compete as an amateur jockey in a life-threatening race."
s5244,Movie,Rocko's Modern Life: Static Cling,"Joe Murray, Cosmo Segurson","Carlos Alazraqui, Tom Kenny, Charlie Adler, Jill Talley, Mr. Lawrence, Joe Murray",United States,"August 9, 2019",2019,TV-Y7,46 min,"Children & Family Movies, Comedies, LGBTQ Movies","After 20 years in space, Rocko struggles to adjust to life in 21st century O-Town and makes it his mission to get his favorite show back on the air."
s5278,Movie,Room on the Broom,"Max Lang, Jani Lachauer","Simon Pegg, Gillian Anderson, Rob Brydon, Martin Clunes, Sally Hawkins, David Walliams, Timothy Spall","United Kingdom, Germany","July 1, 2019",2012,TV-Y7,26 min,"Children & Family Movies, Independent Movies","A gentle witch with a ginger braid offers rides to a variety of animals on her increasingly crowded broom, much to her grumpy cat's chagrin."
s5282,Movie,Roped,Shaun Paul Piccinino,"Josh Swickard, Casper Van Dien, Lorynn York, Christina Moore, John Schneider, Michael Roark, Shane Graham, Cooper Lundeen, Javicia Leslie, Spencer Neville",United States,"May 2, 2020",2020,PG,90 min,"Children & Family Movies, Dramas, Romantic Movies",A star cowboy in a traveling rodeo gets thrown off course when he falls in love with the daughter of a tough-minded town councilman.
s5296,Movie,Rugrats in Paris: The Movie,"Stig Bergqvist, Paul Demeyer","Elizabeth Daily, Tara Strong, Cheryl Chase, Christine Cavanaugh, Cree Summer, Kath Soucie, Michael Bell, Tress MacNeille, Casey Kasem, Joe Alaskey, Debbie Reynolds, Jack Riley, Susan Sarandon, John Lithgow","Germany, United States","October 1, 2019",2000,G,79 min,"Children & Family Movies, Comedies",The Rugrats take to the big screen and visit Paris when Mr. Pickles gets summoned to fix a giant robot at the EuroReptarland theme park.
s5305,TV Show,Running Man,NA,"Kim Seo-yeong, Um Sang-hyun, Kwon Changwook, Kim Yeon-woo, Kang Shi-hyun, Jeon Tae-yeol, Nam Do-hyeong, Park No-sik",NA,"January 1, 2021",2020,TV-Y7,1 Season,"Kids' TV, TV Comedies","Wanting to bring home the ultimate prize, a group of competitors gather for a championship — and discover both friends and enemies as they play!"
s5312,Movie,Russell Madness,Robert Vince,"David Milchard, John Ratzenberger, Will Sasso, Mason Vale Cotton, John Hennigan, Sean Giambrone, Charles Robinson, Mckenna Grace, Kate Reinders, Fred Willard",United States,"May 10, 2015",2015,PG,93 min,"Children & Family Movies, Comedies, Sports Movies","A spunky terrier named Russell with serious wrestling chops becomes a sports phenomenon with the help of his coach, a monkey named Hunk."
s5330,TV Show,Sab Jholmaal Hai,Vijay Roche,NA,India,"October 18, 2020",2017,TV-Y7,3 Seasons,"Kids' TV, TV Comedies","In this madcap comedy, two mischievous cats, a talking parrot and a high-strung dog keep getting into trouble while their human is away."
s5342,Movie,Sahara,Pierre Coré,"Robert Naylor, Angela Galuppo, Daniel Brochu, Mark Hauser, Andrew Shaver, Mathew Mackay, Richard Dumont, Brady Moffatt, Rick Jones, Nadia Verrucci, Sonja Ball","France, Canada","May 12, 2017",2017,TV-Y7,86 min,Children & Family Movies,"When his new love is captured by an evil snake charmer, a young cobra and his scorpion best friend set out across the desert on a wild rescue mission."
s5356,TV Show,Sam & Cat,NA,"Jennette McCurdy, Ariana Grande, Cameron Ocasio, Brandon Weaver, Zoran Korach, Dre Swain, Maree Cheatham, Eduardo Drummond, Alondra Hidalgo",United States,"November 5, 2019",2014,TV-PG,2 Seasons,"Kids' TV, TV Comedies","To earn cash, roommates Sam and Cat start a baby-sitting service – and quickly discover just what an adventure baby-sitting can be."
s5367,TV Show,Sammy & Co,NA,NA,France,"December 25, 2015",2014,TV-Y,1 Season,"Kids' TV, TV Comedies","In an underwater village bordering a tropical island, two young turtles and their pals keep their home safe and enjoy adventures in the big, wild sea."
s5370,Movie,Samudri Lootere,Anirban Majumder,"Sonal Kaushal, Rupa Bhimani, Julie Tejwani, Sabina Malik, Jigna Bharadhwaj, Rajesh Kawa",NA,"June 18, 2019",2018,TV-Y,65 min,Children & Family Movies,The king’s ship has been taken over by seemingly fearless pirates! Can Bheem find the one thing that might scare them away?
s5382,Movie,Santa Claws,Glenn Miller,"Nicola Lambo, Evan Boymel, John P. Fowler, Erica Duke, Ezra James Colbert",United States,"November 17, 2017",2014,TV-PG,86 min,"Children & Family Movies, Comedies","When a gift sack full of kittens gives Santa a bad allergic reaction, the kitties have to take over and deliver the presents on time."
s5383,Movie,Santa Girl,Blayne Weaver,"Barry Bostwick, Jennifer Stone, Devon Werkheiser, McKayla Witt, Joshua Cody, Hank Stone",United States,"November 1, 2019",2019,TV-PG,91 min,"Children & Family Movies, Comedies, Romantic Movies","Fleeing the family business and an arranged marriage, Santa’s daughter chooses a magical adventure of her own: College."
s5385,Movie,Santa's Apprentice,Luc Vinciguerra,"Julie Gayet, Jean-Pierre Marielle, Lorànt Deutsch, Bruno Salomone, Pierre-François Martin-Laval, Didier Brice, Benoît Allemane, Nathan Simony, Daniela Duspara, Max Cullen","Australia, France, Ireland","December 20, 2015",2010,TV-G,72 min,Children & Family Movies,"Young orphan Nicolas learns how to guide a sleigh, slide down chimneys and other duties he'll need when he becomes the next Santa Claus."
s5405,Movie,Satria Heroes: Revenge of the Darkness,"Kenzo Maihara, Amandha Wyanto","Christian Loho, Fernando Surya, Yayan Ruhian, Stella Cornelia, Yui Takano, Safira Ratu, Faris Fadjar Munggaran, Adhitya Alkatiri",Indonesia,"September 10, 2020",2017,TV-G,92 min,Children & Family Movies,"As he rebuilds society in a parallel universe, a superhero must return to Earth to help his equally powerful friend defend the planet from evil rivals."
s5423,Movie,Scales: Mermaids Are Real,Kevan Peterson,"Emmy Perry, Morgan Fairchild, Elisabeth Röhm, Nikki Hahn, Jack Dylan Grazer, Stephen Snedden, Noree Victoria, Sterling Sulieman",United States,"January 23, 2020",2017,PG,93 min,Children & Family Movies,A seemingly ordinary girl learns she will turn into a mermaid on her 12th birthday and be forced to leave her life on land behind.
s5438,Movie,Scooby-Doo on Zombie Island,"Hiroshi Aoyama, Kazumi Fukushima, Jim Stenstrum","Scott Innes, Billy West, Mary Kay Bergman, Frank Welker, B.J. Ward, Adrienne Barbeau, Tara Strong, Cam Clarke, Mark Hamill",United States,"December 15, 2019",1998,TV-PG,77 min,Children & Family Movies,"When Daphne's TV show does a segment on real monsters, the gang fires up the Mystery Machine and heads to Moonscar Island, where zombies await."
s5439,TV Show,Scooby-Doo!: Mystery Incorporated,NA,"Frank Welker, Mindy Cohn, Grey DeLisle, Matthew Lillard, Patrick Warburton, Gary Cole, Frances Conroy, Vivica A. Fox",United States,"December 15, 2019",2012,TV-Y7,2 Seasons,"Kids' TV, TV Comedies","In this animated update of the cartoon classic, Scooby-Doo, Shaggy and their pals solve spooky mysteries in a hamlet bedeviled by supernatural bedlam."
s5450,Movie,Searching for Bobby Fischer,Steven Zaillian,"Max Pomeranc, Joe Mantegna, Joan Allen, Ben Kingsley, Laurence Fishburne, William H. Macy, Laura Linney, David Paymer, Michael Nirenberg, Robert Stephens",United States,"December 7, 2020",1993,PG,110 min,"Children & Family Movies, Classic Movies, Dramas","When a father learns that his 7-year-old son is a whiz at speed chess, he hires an implacable chess master to coach the boy for competitions."
s5514,TV Show,Seven and Me,NA,"Leila Jolene, Flavio Parenti, Josefin Asplund",France,"October 15, 2017",2017,TV-Y,1 Season,Kids' TV,A little girl discovers she’s the modern-day descendant of Snow White when seven dwarfs arrive at her suburban home to serve as her guardian angels.
s5546,TV Show,Shaun the Sheep,NA,"John Sparkes, Justin Fletcher, Kate Harbour, Richard Webber, Jo Allen","United Kingdom, Finland, Germany","December 22, 2020",2016,TV-Y,2 Seasons,"British TV Shows, Kids' TV, TV Comedies","Join freewheeling Shaun for barnyard misadventures with his cousin Timmy, giant sheepdog Bitzer, jealous cat Pidsley and fellow sheep Shirley."
s5547,TV Show,Shaun the Sheep: Adventures from Mossy Bottom,NA,"John Sparkes, Justin Fletcher, Marcus Brigstocke, Simon Greenall, Kate Harbour, Emma Tate, Andy Nyman, Richard Webber",United Kingdom,"March 17, 2020",2020,TV-Y7,1 Season,"British TV Shows, Kids' TV, TV Comedies","Clever sheep Shaun, loyal dog Bitzer and the rest of the Mossy Bottom gang cook up oodles of fun and mischief on the farm."
s5548,Movie,Shaun the Sheep: The Farmer’s Llamas,Jay Grace,"Justin Fletcher, John Sparkes, Sean Connolly, Chris Grimes",United Kingdom,"December 22, 2020",2020,TV-Y,28 min,"Children & Family Movies, Comedies","A trio of mischievous llamas from the county fair start making a mess of the farm, so Shaun and the flock must find a way to boot out the troublemakers."
s5555,TV Show,She-Ra and the Princesses of Power,NA,"Aimee Carrero, AJ Michalka, Marcus Scribner, Karen Fukuhara, Reshma Shetty, Lorraine Toussaint, Keston John, Lauren Ash, Christine Woods, Morla Gorrondona, Antony Del Rio, Dana Davis, Grey Griffin, Genesis Rodriguez, Jordan Fisher, Vella Lovell, Merit Leighton, Sandra Oh, Krystal Joy Brown",United States,"May 15, 2020",2020,TV-Y7,5 Seasons,"Kids' TV, TV Action & Adventure, TV Sci-Fi & Fantasy","Soldier Adora finds a magic sword – and her identity as legendary hero She-Ra. She joins the Rebellion, but her best friend stays with the evil Horde."
s5575,TV Show,Shopkins,NA,Kate Murphy,United States,"February 1, 2020",2014,TV-Y,1 Season,Kids' TV,"Tiny grocery store items come to life as the Shopkins, who have fun adventures with each other at Small Mart and the magical town called Shopville."
s5583,Movie,Shorts,Robert Rodriguez,"Jimmy Bennett, Jake Short, Kat Dennings, Trevor Gagnon, Devon Gearhart, Jolie Vanier, Rebel Rodriguez, Leo Howard, Leslie Mann, Jon Cryer, William H. Macy, James Spader","United States, United Arab Emirates","July 1, 2019",2009,PG,89 min,"Children & Family Movies, Comedies",Chaos erupts when locals learn that an 11-year-old boy has discovered a mysterious rock that grants the wishes of whoever possesses it.
s5588,Movie,Shrek the Musical,Jason Moore,"Brian d'Arcy James, Daniel Breaker, Sutton Foster, Christopher Sieber, John Tartaglia, Rozi Baker, Ryan Duncan, Leah Greenhaus, Chris Hoch, Marissa O'Donnell, Denny Paschall",United States,"December 29, 2013",2013,TV-G,130 min,"Children & Family Movies, Comedies, Music & Musicals","The greatest fairy tale never told comes to life in this colorful, song-filled, Tony Award-winning Broadway production based on the hit movie."
s5599,TV Show,Sid the Science Kid,NA,"Drew Massey, Julianne Buescher, Victor Yerrid, Alice Dinnean, Donna Kimball, John Munro Cameron, Kristin Charney",United States,"March 31, 2020",2008,TV-Y,1 Season,Kids' TV,"Armed with a healthy sense of humor and the help of his teacher, friends and family, curious kid Sid tackles questions youngsters have about science."
s5606,Movie,Silent,"Limbert Fabian, Brandon Oldenburg",NA,United States,"June 4, 2019",2014,TV-Y,3 min,"Children & Family Movies, Sci-Fi & Fantasy","""Silent"" is an animated short film created by Academy Award® winning Moonbot Studios. It celebrates how storytellers, inventors, and technology work together to create cinema magic."
s5613,TV Show,Simon,NA,"Loti Bailey, Hayden Connett, Keith Faulkner, Rudy Greatorex, Luke Haliwell, Jacob Preston, Joanna Ruiz, Alex Starke",France,"May 1, 2018",2016,TV-Y,1 Season,Kids' TV,"With his vivid imagination, Simon the rabbit searches for fun while learning about the importance of responsibility and communication."
s5644,Movie,Sitara: Let Girls Dream,Sharmeen Obaid-Chinoy,NA,"Pakistan, United States","March 8, 2020",2020,TV-PG,16 min,"Children & Family Movies, Dramas","In this silent short set in 1970s Pakistan, 14-year-old Pari longs to be a pilot, unaware that her father plans to marry her off to a much older man."
s5657,TV Show,Skylanders Academy,NA,"Justin Long, Ashley Tisdale, Jonathan Banks, Chris Diamantopoulos, Bobcat Goldthwait, Richard Steven Horvitz, Norm MacDonald, Daniel Middleton, Catherine O'Hara, Parker Posey, Jonny Rees, Jason Ritter, Susan Sarandon, Harland Williams, Daniel Wu, Dee Bradley Baker, Chris Cox, Jim Cummings, Felicia Day, John DiMaggio, Grey Griffin","South Korea, United States","September 28, 2018",2018,TV-Y7,3 Seasons,"Kids' TV, TV Comedies",Travel the vast Skylander universe in this animated series as a ragtag group of academy graduates build trust and heart in their fight against evil.
s5683,Movie,Snow Day,Chris Koch,"Chris Elliott, Mark Webber, Jean Smart, Schuyler Fisk, Iggy Pop, Pam Grier, John Schneider, Chevy Chase, Zena Grey, Josh Peck",United States,"January 1, 2020",2000,PG,89 min,"Children & Family Movies, Comedies","When a snow day shuts down the whole town, the Wheeler family cuts loose. Hal makes a play for the most popular girl in his school, 10-year-old Natalie takes on the dreaded snowplow man, and Dad gets into a showdown with a rival meteorologist."
s5693,TV Show,Sofia the First,NA,"Ariel Winter, Darcy Rose Byrnes, Sara Ramirez, Tim Gunn, Coco Grayson, Travis Willingham, Wayne Brady, Jess Harnell, Meghan Strange, Zach Callison",United States,"October 8, 2018",2017,TV-Y,4 Seasons,Kids' TV,"When her commoner mother marries the king, average-girl Sofia finds that being a real princess isn't all it's cracked up to be."
s5699,Movie,Solo: A Star Wars Story,Ron Howard,"Alden Ehrenreich, Woody Harrelson, Emilia Clarke, Donald Glover, Joonas Suotamo, Thandie Newton, Phoebe Waller-Bridge, Paul Bettany",United States,"January 9, 2019",2018,PG-13,135 min,"Action & Adventure, Children & Family Movies, Sci-Fi & Fantasy","A young Han Solo tries to settle an old score with the help of his new buddy Chewbacca, a crew of space smugglers and a cunning old friend."
s5700,Movie,Solo: A Star Wars Story (Spanish Version),Ron Howard,"Alden Ehrenreich, Woody Harrelson, Emilia Clarke, Donald Glover, Joonas Suotamo, Thandie Newton, Phoebe Waller-Bridge, Paul Bettany",United States,"January 9, 2019",2018,PG-13,135 min,"Action & Adventure, Children & Family Movies, Sci-Fi & Fantasy","A young Han Solo tries to settle an old score with the help of his new buddy Chewbacca, a crew of space smugglers and a cunning old friend."
s5702,TV Show,Some Assembly Required,NA,"Kolton Stewart, Harrison Houde, Charlie Storwick, Sydney Scotia, Travis Turner, Ellie Harvie, Dylan Playfair",Canada,"October 16, 2015",2015,TV-Y,2 Seasons,"Kids' TV, TV Comedies",A 14-year-old takes ownership of a toy company and hires a group of his friends to help him create amazing new toys.
s5720,TV Show,Sonic X,NA,"Junichi Kanemaru, Sanae Kobayashi, Ryo Hirohashi, Taeko Kawata, Nobutoshi Canna, Koji Yusa, Rumi Ochiai, Sayaka Aoki, Chikao Otsuka",Japan,"January 29, 2020",2003,TV-Y7,2 Seasons,"Anime Series, Kids' TV","A mission gone awry transports Sonic the Hedgehog, his friends, Dr. Eggman and the Chaos Emeralds to another dimension: Earth."
s5735,TV Show,Space Jungle,NA,"Kim Min-hee, Park Yoon-hee, Sun Sung-wook",NA,"December 1, 2019",2016,TV-Y,2 Seasons,"Kids' TV, Korean TV Shows, TV Comedies","A broken spaceship strands four very tiny aliens on Earth, where they discover an adventure (and strange dangers!) that they never expected."
s5736,TV Show,Space Racers,NA,"Yuri Lowenthal, Meyer DeLeeuw, Johnny Yong Bosch, Phil Lollar, Alicyn Packard, Melissa Hutchison, Joseph J. Terry, Danny Katiana, Katie Leigh",United States,"March 31, 2020",2014,TV-Y,1 Season,Kids' TV,"Spaceships Eagle, Robyn, Hawk and their pals at the Stardust Space Academy rocket through the galaxy, teaching kids about the wonders of science."
s5750,Movie,Spelling the Dream,Sam Rega,NA,United States,"June 3, 2020",2020,TV-G,83 min,"Children & Family Movies, Documentaries","Following four hopeful competitors, this documentary explores Indian Americans' decades-long success at the biggest spelling contest in the U.S."
s5757,TV Show,Spirit Riding Free: Pony Tales,NA,"Amber Frank, Bailey Gambertoglio, Sydney Park, Darcy Rose Byrnes, Gabriella Graves, Duncan Joiner, Nolan North",United States,"October 18, 2019",2019,TV-Y7,2 Seasons,Kids' TV,"Find the fun and adventure of ""Spirit Riding Free"" in this mix of music videos and short episodes featuring Lucky and all of her friends!"
s5758,Movie,Spirit Riding Free: Ride Along Adventure,"Beth Sleven, Allan Jacobsen, Kevin Wotton","Amber Frank, Bailey Gambertoglio, Sydney Park, Katey Sagal, Rachel Kimsey, Darcy Rose Byrnes, Duncan Joiner, Bella Aboulhosn, Kai Scott",United States,"December 8, 2020",2020,TV-Y7,79 min,Children & Family Movies,Join Lucky and her friends on an interactive mission to save Maricela’s beloved mare from greedy horse thieves who've taken her captive with a wild herd.
s5759,TV Show,Spirit Riding Free: Riding Academy,NA,"Amber Frank, Bailey Gambertoglio, Sydney Park, Darcy Rose Byrnes, Rhys Darby",United States,"September 4, 2020",2020,TV-Y7,2 Seasons,Kids' TV,A new chapter begins for Lucky and her friends as they leave Miradero behind to live and learn at the prestigious Palomino Bluffs Riding Academy.
s5760,Movie,Spirit Riding Free: Spirit of Christmas,NA,"Amber Frank, Bailey Gambertoglio, Sydney Park, Evan Agos, Kay Bess, Darcy Rose Byrnes, David Faustino, Gabriella Graves, Duncan Joiner, Katherine McNamara, Nolan North, Tiya Sircar",United States,"December 6, 2019",2019,TV-Y7,46 min,Children & Family Movies,Lucky and friends must figure out how to get home in time for Christmas when a falling boulder – and a serious snowstorm – derail their travel plans.
s5761,TV Show,Spirit: Riding Free,NA,"Amber Frank, Sydney Park, Bailey Gambertoglio, Darcy Rose Byrnes, Nolan North, Kari Wahlgren, Andy Pessoa, Tiya Sircar, Jonathan Craig WIlliams, Robert Knepper",United States,"April 5, 2019",2019,TV-Y7,8 Seasons,Kids' TV,"In a small Western town, spunky ex-city girl Lucky forms a tight bond with wild horse Spirit while having adventures with best pals Pru and Abigail."
s5765,TV Show,Splash and Bubbles,NA,"John Tartaglia, Leslie Carrara-Rudolph, Raymond Carr, Aymee Garcia",United States,"August 13, 2018",2018,TV-Y,2 Seasons,Kids' TV,"Curious pals Splash, Bubbles, Dunk and Ripple have fun exploring new places, making new friends and learning all about their amazing ocean home."
s5767,Movie,Spookley and the Christmas Kittens,Bernie Denk,"Vlasta Vrana, Sonja Ball, Craig Francis, Richard C. Jones, Michael Perron, Terrence Scammell, Bruce Dinsmore, Jennifer Seguin, Daniel Brochu",United States,"November 30, 2020",2019,TV-Y,45 min,Children & Family Movies,"When a green cat and three stray kittens wind up at Holiday Hill Farm, Spookley the Square Pumpkin and his friends help the felines find their way home."
s5768,Movie,Spookley the Square Pumpkin,Bernie Denk,"Sonja Ball, Craig Francis, Rick Jones, Michel Perron, Holly Gauthier-Frankel, Norman Groulx, Terrence Scammell, Bruce Dinsmore, Jennifer Seguin",United States,"September 1, 2019",2004,G,47 min,Children & Family Movies,"When a storm terrorizes his patch, a pumpkin cast out for his shape must step up to use his smarts to save the day – and to prove himself."
s5774,Movie,Spy Kids,Robert Rodriguez,"Antonio Banderas, Carla Gugino, Alan Cumming, Teri Hatcher, Cheech Marin, Danny Trejo, Robert Patrick, Tony Shalhoub, Alexa PenaVega, Daryl Sabara",United States,"April 1, 2019",2001,PG,88 min,"Children & Family Movies, Comedies",The tables are turned when pint-sized kids Carmen and Juni must rescue their secret-agent parents from the diabolical clutches of Alexander Minion.
s5775,Movie,Spy Kids 2: The Island of Lost Dreams,Robert Rodriguez,"Antonio Banderas, Carla Gugino, Alexa PenaVega, Daryl Sabara, Steve Buscemi, Mike Judge, Danny Trejo, Cheech Marin, Matt O'Leary, Emily Osment, Ricardo Montalban, Holland Taylor, Alan Cumming",United States,"March 8, 2019",2002,PG,100 min,"Children & Family Movies, Comedies","Spy kids Carmen and Juni Cortez team up with two other pint-size secret agents, Gary and Gerti Giggles, in order to take on an evil scientist."
s5776,Movie,Spy Kids 3: Game Over,Robert Rodriguez,"Daryl Sabara, Sylvester Stallone, Ricardo Montalban, Alexa PenaVega",United States,"April 1, 2019",2003,PG,83 min,"Children & Family Movies, Comedies","Carmen gets caught in a virtual reality game designed by the kids' new nemesis, the Toymaker, and it's up to Juni to save her by beating the game."
s5777,Movie,Spy Kids: All the Time in the World,Robert Rodriguez,"Jessica Alba, Joel McHale, Rowan Blanchard, Mason Cook, Jeremy Piven, Alexa PenaVega, Daryl Sabara, Ricky Gervais, Danny Trejo",United States,"February 19, 2019",2011,PG,88 min,"Children & Family Movies, Comedies",Former Spy Kids Carmen and Juni return to help twin siblings Rebecca and Cecil Wilson save the world with their retired secret-agent stepmother.
s5778,TV Show,Spy Kids: Mission Critical,NA,"Ashley Bornancin, Carter Hastings, Caitlyn Bairstow, Nicholas Coombe, Nesta Cooper, Richard Ian Cox, Tom Kenny, Travis Turner, Candi Milo, Mira Sorvino","United States, Canada","November 30, 2018",2018,TV-Y7,2 Seasons,Kids' TV,"In this animated spinoff series, Juni and Carmen Cortez must battle the evil organization S.W.A.M.P. – without the help of their super-spy parents."
