show_id,type,title,director,cast,country,date_added,release_year,rating,duration,genre,description
s2273,Movie,Free Rein: The Twelve Neighs of Christmas,Marek Losey,"Jaylen Barron, Billy Angel, Manpreet Bambra, Celine Buckens, Freddy Carter, Bruce Herbelin-Earle, Kerry Ingram, Charlotte Jordan, Geoff McGivern, Martin Bobb-Semple",NA,"December 7, 2018",2018,TV-G,58 min,"Children & Family Movies, Dramas","As Bright Fields preps for its Mistletoe Ball, a broken ornament leads Zoe to a family secret, while Gaby finds herself at the mercy of new boss Mia."
s2274,Movie,Free Rein: Valentine's Day,NA,"Jaylen Barron, Joe Ashman, Manpreet Bambra, Celine Buckens, Freddy Carter, Bruce Herbelin-Earle, Kerry Ingram, Charlotte Jordan, Geoffrey McGivern, Martin Bobb-Semple, Sadie Simm, Carla Woodcock",United States,"February 1, 2019",2019,TV-G,51 min,"Children & Family Movies, Dramas","Love is in the air as Zoe and friends go on a quest to find a fabled Maid's Stone. But when rivalry blinds them to danger, it's Raven to the rescue!"
s2276,Movie,Free Willy,Simon Wincer,"Jason James Richter, Lori Petty, Jayne Atkinson, August Schellenberg, Michael Madsen, Michael Ironside, Richard Riehle, Mykelti Williamson, Michael Bacall, Danielle Harris","United States, France, Mexico","January 1, 2020",1993,PG,112 min,"Children & Family Movies, Dramas","Ordered to clean up the graffiti he painted at a marine theme park, a troubled young boy unexpectedly bonds with a killer whale on exhibit."
s2294,Movie,From Japan to Egypt,Mahmoud Karim,"Ahmed Eid, Saki Tsukamoto, Nada Moussa, Mohammed Tharwat",Egypt,"June 6, 2019",2017,TV-14,93 min,"Children & Family Movies, Comedies, Dramas","After his wife relocates to her home country of Japan, an Egyptian man – and father of two rambunctious kids – tries to win her back."
s2307,TV Show,Fukrey Boyzzz,NA,"Viraaj Modgill, Jasleen Singh, Pooja Punjabi, Viswanathan Sridhar, Manish Bhavan, Suvela Sharma, Surabhi Pandey, Zeel Thakkar",NA,"September 19, 2020",2020,TV-Y,1 Season,"Kids' TV, TV Comedies","A troublemaking trio dreams big, plays hard and stirs up all sorts of classroom mischief in this animated spinoff of the popular Hindi film franchise."
s2308,Movie,Fukrey Boyzzz: Space Mein Fukrapanti,Avinash Walzade,"Viraaj Modgill, Jasleen Singh, Pooja Punjabi, Amit Deondi, Ketan Kava, Zeel Thakkar, Manish Bhavan, Viswanathan Sridhar",India,"November 13, 2020",2020,TV-Y7,75 min,"Children & Family Movies, Comedies","After a foreboding dream about aliens comes true, a fun-loving trio must prevent human intelligence from being stolen from planet Earth."
s2309,Movie,Full Count,Robert Eagar,"John Paul Kakos, Natalia Livingston, E. Roger Mitchell, Rick Hearst, Jason London, Victoria Elizabeth Staley, Adam Boyer",United States,"February 23, 2020",2019,TV-PG,110 min,"Children & Family Movies, Dramas, Faith & Spirituality","When tragic events force an aspiring baseball player to forgo his big league dreams and return home, saving the family farm grants him renewed purpose."
s2310,Movie,Full Out,Sean Cisterna,"Jennifer Beals, Ana Golja, Art Hindle, Jake Epstein, Ramona Milano, Trevor Tordjman, Lamar Johnson, Asha Bromfield, Sarah Fisher","Canada, United States","September 1, 2016",2015,TV-PG,88 min,"Children & Family Movies, Dramas, Sports Movies","After a debilitating accident ends her Olympic dreams, gymnast Ariana Berlin finds recovery and hope in the world of hip-hop and college athletics."
s2311,Movie,Full Out 2: You Got This!,Jeff Deverett,"Sydney Cope, Logan Edra, Liza Wilk, Braedyn Bruner, Billie Merritt",United States,"January 1, 2021",2020,TV-Y,91 min,"Children & Family Movies, Dramas, Sports Movies","With a championship on the line, Chayse and her gymnastics team look to a local break-dancer for all the right moves to rise above their competition."
s2324,Movie,G-Force,Hoyt Yeatman,"Bill Nighy, Will Arnett, Zach Galifianakis, Kelli Garner, Tyler Patrick Jones, Piper Mackenzie Harris, Gabriel Casseus, Jack Conley, Niecy Nash, Justin Mentell, Nicolas Cage, Sam Rockwell, Jon Favreau, Penélope Cruz, Steve Buscemi, Tracy Morgan",United States,"March 15, 2019",2009,PG,88 min,"Children & Family Movies, Comedies","When a billionaire sets out to take over the world, only one special forces unit can handle the job – a squad of highly trained guinea pigs."
s2328,TV Show,Gabby's Dollhouse,NA,"Laila Lockhart Kraner, Tucker Chandler, Juliet Donenfeld, Maggi Lowe, Donovan Patton, Eduardo Franco, Tara Strong, Secunda Wood, Carla Tassara, Sainty Nelsen",NA,"January 5, 2021",2021,TV-Y,1 Season,Kids' TV,"Cute cats, quirky crafts and colorful magic! Join kitty enthusiast Gabby and her sidekick Pandy Paws as they team up for a series of animated adventures."
s2341,TV Show,GAME ON: A Comedy Crossover Event,NA,"Loretta Devine, Tia Mowry-Hardrict, Anthony Alabi, Paul Wight, Allison Munn, Gabriel Iglesias, Sherri Shepherd, Paulina Chávez, Jencarlos Canela",United States,"August 10, 2020",2020,TV-G,1 Season,"Kids' TV, TV Comedies","Worlds collide in this special event featuring familiar faces, surprise cameos and stories of spirited competition from four different comedy series."
s2356,Movie,Garfield Gets Real,"Mark A.Z. Dippé, Kyung Ho Lee","Frank Welker, Wally Wingert, Gregg Berger, Jennifer Darling, Pat Fraley, Jason Marsden, Neil Ross, Audrey Wasilewski, Stephen Stanton, Greg Eagles",United States,"January 1, 2020",2007,TV-Y,78 min,"Children & Family Movies, Comedies","After trying to live in the ""real world"" and concluding it isn't for him, Garfield must return to his comic-strip home before getting trapped forever."
s2357,Movie,Garfield's Fun Fest,"Mark A.Z. Dippé, Eondeok Han","Frank Welker, Tim Conway, Gregg Berger, Wally Wingert, Audrey Wasilewski, Fred Tatasciore, Stephen Stanton, Jennifer Darling, Neil Ross, Greg Eagles","United States, South Korea","January 1, 2020",2008,TV-Y7,79 min,"Children & Family Movies, Comedies","Garfield has long been the champ at a yearly competition for the funniest comic strip. But this time, Garfield must battle tall, handsome Ramone."
s2358,Movie,Garfield's Pet Force,Mark A.Z. Dippé,"Frank Welker, Vanessa Marshall, Gregg Berger, Wally Wingert, Audrey Wasilewski, Jason Marsden, Fred Tatasciore, Stephen Stanton, Jennifer Darling, Neil Ross, Greg Eagles, Cathy Cavadini, David Michie, Greg Finley","South Korea, United States","January 1, 2020",2009,G,78 min,"Children & Family Movies, Comedies","When an alien menace and her army of undead minions threaten to enslave the world, Garfield heads a team of comic-strip superheroes to save the day."
s2362,Movie,Garuda Di Dadaku,Ifa Isfansyah,"Emir Mahira, Maudy Koesnaedi, Ikranagara, Aldo Tansani, Marsha Aruan, Ari Sihasale",Indonesia,"October 9, 2018",2009,TV-PG,96 min,"Children & Family Movies, Dramas, Sports Movies","A determined boy will do anything to become a great soccer player, despite the wishes of his grandfather."
s2363,Movie,Garuda in My Heart 2,Rudy Soedjarwo,"Emir Mahira, Aldo Tansani, Maudy Koesnaedi, Ramzi, Rio Dewanto, Monica Sayangbati, Rendy Khrisna",Indonesia,"November 30, 2018",2011,TV-PG,95 min,"Children & Family Movies, Dramas, Sports Movies",A young soccer player sets out to prove he can lead his team to a championship – but being a winner is about more than just talent.
s2379,Movie,George of the Jungle 2,David Grossman,"Christopher Showerman, Julie Benz, Angus T. Jones, Thomas Haden Church, Christina Pickles, John Cleese, Michael Clarke Duncan, John Kassir, Kevin Greutert, Keith Scott","United States, Australia","December 20, 2016",2003,PG,87 min,"Children & Family Movies, Comedies","Now married and raising a son, clumsy ape-man George finds his jungle kingdom in peril as Really Mean Lion challenges him for the throne."
s2381,TV Show,Geronimo Stilton,Guy Vasilovich,"Brian Drummond, Erin Mathews, Richard Ian Cox, Sarah Edmondson, Moneca Stori","Italy, Canada, France","December 31, 2017",2011,TV-Y,1 Season,"Kids' TV, TV Comedies","With the help of brainy and adventurous sidekicks, New Mouse City's favorite journalist investigates mysteries that take him around the world,"
s2387,Movie,Get Santa,Christopher Smith,"Jodie Whittaker, Warwick Davis, Jim Broadbent, Stephen Graham, Nonso Anozie, Rafe Spall, Ewen Bremner, Matt King","United Kingdom, United States","December 12, 2014",2014,PG,103 min,"Children & Family Movies, Comedies","When Santa gets arrested for trespassing after crashing his sleigh, it's up to a father-son team to spring him from jail and save Christmas."
s2399,Movie,Ghost Patrol,Karen J. Lloyd,"Scott McNeil, Vincent Tong, Travis Turner, Shannon Chan-Kent, Lili Beaudoin",Canada,"October 1, 2017",2016,TV-Y7,47 min,"Children & Family Movies, Comedies",Two kids and their pet dog (aka the Ghost Patrol) get a call about an old manor and soon find they are investigating their first real haunted house.
s2410,TV Show,Gigantosaurus,NA,NA,United States,"July 18, 2020",2019,TV-Y,1 Season,Kids' TV,"Four prehistoric friends go on an array of adventures while trying to unravel a mystery about a big, fierce creature. Based on Jonny Duddle's book."
s2438,TV Show,Glitch Techs,NA,"Ricardo Hurtado, Monica Ray, Luke Youngblood, Scott  Kreamer, Dan Milano, Gunnar Sizemore, Zehra Fazal, Sandeep Parikh",United States,"August 17, 2020",2020,TV-Y7,2 Seasons,Kids' TV,Two teens work at a game store as a front for their actual job: Hunting video game monsters who've broken out into the real world.
s2439,TV Show,Glitter Force,NA,"Laura Bailey, Kate Higgins, Alex Cazares, Colleen O'Shaughnessey, Danielle Nicole, Debi Derryberry, Mary Elizabeth McGlynn, Patrick Seitz, Keith Silverstein",Japan,"August 26, 2016",2016,TV-Y7,2 Seasons,"Anime Series, Kids' TV",Five preteen girls learn they're a legendary superhero squad known as the Glitter Force. Their mission? To defend Earth from evil fairy-tale villains.
s2440,TV Show,Glitter Force Doki Doki,Go Koga,"Debi Derryberry, Cassandra Morris, Melissa Fahn, Stephanie Sheh, Erica Lindbeck, Kate Higgins, Cherami Leigh, Tara Sands, Bryce Papenbrook, Erica Mendez, Ray Chase, Carrie Keranen, Ben Diskin, Grant George, Kirk Thornton",Japan,"November 10, 2017",2017,TV-Y7,2 Seasons,"Anime Series, Kids' TV",Four girls summon their inner superheroes to defend Earth and the magical kingdom of Splendorius from King Mercenare and his minions.
s2445,Movie,Gnome Alone,Peter Lepeniotis,"Becky G., Josh Peck, Tara Strong, Olivia Holt, David Koechner, Jeff Dunham, Patrick Stump, Nash Grier, Madison De La Garza, George Lopez","United Kingdom, Canada, United States, Cayman Islands","October 19, 2018",2018,PG,86 min,"Children & Family Movies, Comedies","After moving into a new house with her mom, high schooler Chloe discovers a troupe of talking garden gnomes who need her help saving the world."
s2446,Movie,Go Karts,Owen Trevor,"William Lodder, Anastasia Bampos, Darius Amarfio-Jefferson, Richard Roxburgh, Frances O'Connor, Dan Wyllie, Cooper van Grootel, Damian de Montemas, Adam T. Perkins",Australia,"March 13, 2020",2020,TV-PG,103 min,"Children & Family Movies, Dramas","A fearless teen leans into the rush of high-speed go-kart racing, backed by good friends — and a surly ex-driver who becomes his coach."
s2447,TV Show,Go! Go! Cory Carson,NA,"Alan C. Lim, Paul Killam, Maisie Benson, Kerry Gudjohnsen, Smith Foreman, Neena-Sinaii Simpo, Eli Morse, Adelaide Hirasaki, Jim Capobianco, Anna Chambers, Pfifer Chastain",United States,"December 26, 2020",2020,TV-Y,3 Seasons,Kids' TV,"Beep, beep – go, go! Buckle up for fun and adventure with adorable kid car Cory Carson as he explores the winding roads of Bumperton Hills."
s2448,Movie,Go! Go! Cory Carson: The Chrissy,"Alex Woo, Stanley Moore","Alan C. Lim, Maisie Benson, Kerry Gudjohnsen, Terrance Smith, Paul Killam, Omari Weaver, Ella Joy Ballesteros, Smith Foreman, Stanley Moore",United States,"May 1, 2020",2020,TV-Y,42 min,Children & Family Movies,"The Carson kids win a talent show with a dance that Cory created. But when ""The Chrissy"" catches on, his little sister gets all of the attention."
s2449,TV Show,Go! Live Your Way,NA,"Pilar Pascual, Renata Toscano, José Giménez Zapiola, Santiago Saez, Paulo Sanchez Lima, Carmela Barsamian, Axel Muñiz, Majo Cardoso, Majo Chicar, Gastón Ricaud, Laura Azcurra",Argentina,"June 21, 2019",2019,TV-PG,2 Seasons,"Kids' TV, Spanish-Language TV Shows, Teen TV Shows","Charismatic Mía gets a scholarship to an elite performing arts school, where she makes close friends but clashes with the owner's popular daughter."
s2450,Movie,GO! The Unforgettable Party,Mauro Scandolari,"Pilar Pascual, José Gimenez Zapiola, Renata Toscano, Santiago Saez, Carmela Barsamian, Paulo Sánchez Lima, Daniel Rosado, Laura Azcurra, Gastón Ricaud, Florencia Benítez, Majo Cardozo",Argentina,"November 15, 2019",2019,TV-PG,60 min,"Children & Family Movies, Music & Musicals","Mía's vacation with her dad is disrupted by the surprise arrival of Lupe, Mercedes, Juanma and Álvaro as their school drama moves lakeside."
s2451,Movie,God Bless the Broken Road,Harold Cronk,"Patrika Darbo, Kim Delaney, Jordin Sparks, Makenzie Moss, Liam Matthews, Andrew W. Walker, Lindsay Pulsipher, Gary Grubbs, Robin Givens, Arthur Cartwright",United States,"February 9, 2019",2018,PG,111 min,"Children & Family Movies, Dramas, Faith & Spirituality","After a young mother is widowed by war, her faith is tested as she struggles to stay afloat financially and raise her daughter."
s2463,Movie,Going for Gold,Clay Glen,"Kelli Berglund, Emily Morris, Terry Rogers, Jess Kuss, Jo Stone, Elysia Markou, Daisy Anderson, Ruth Natalie Fallon, Henry Turczynowicz, Martha Lott",Australia,"July 15, 2018",2018,TV-G,88 min,"Children & Family Movies, Dramas, International Movies","After moving to Australia, an American teen convinces her new friends to form a cheer squad and take on their biggest rivals in competition."
s2468,TV Show,Goldie & Bear,NA,"Natalie Lander, Georgie Kidder",United States,"October 31, 2018",2017,TV-Y,2 Seasons,Kids' TV,"Best pals Goldie and Bear, from ""Goldilocks and the Three Bears,"" join other characters from beloved stories for adventures in the Fairy Tale Forest."
s2477,Movie,Good Burger,Brian Robbins,"Kenan Thompson, Kel Mitchell, Abe Vigoda, Dan Schneider, Shar Jackson, Jan Schweiterman, Linda Cardellini, Sinbad, Ron Lester, Josh Server, Ginny Schreiber",United States,"January 1, 2021",1997,PG,96 min,"Children & Family Movies, Comedies","Working at a neighborhood fast-food joint, two teens try to save the restaurant when a giant burger franchise fires up the competition."
s2490,Movie,Good Sam,Kate Melville,"Tiya Sircar, Chad Connell, Marco Grazzini, Jesse Camacho, Mark Camacho, Elana Dunkelman, Kelly Hope Taylor, Kenny Wong, Daniela Sandiford, Christina Tannous",United States,"May 16, 2019",2019,TV-PG,90 min,"Children & Family Movies, Dramas",A curious reporter finds love while pursuing the story of a mysterious figure who's leaving bags of cash for strangers around New York City.
s2499,TV Show,Goosebumps,NA,R.L. Stine,Canada,"November 19, 2014",1998,TV-G,5 Seasons,"Kids' TV, TV Thrillers",R.L. Stine's tales take on a life of their own in a series that combines original stories with adaptations drawn from the popular books.
s2500,Movie,Goosebumps 2: Haunted Halloween,Ari Sandel,"Jeremy Ray Taylor, Madison Iseman, Caleel Harris, Wendi McLendon-Covey, Chris Parnell, Ken Jeong, Jack Black","United States, United Kingdom","April 25, 2019",2018,PG,90 min,"Children & Family Movies, Comedies","Three teens spend their Halloween trying to stop a magical book, which brings characters from the ""Goosebumps"" novels to life."
s2502,TV Show,Gormiti,NA,"Dermot Arrigan, Jenny Beacraft, Stephanie Figueira, Ella Galt, James Giblin, Noah Levin","Spain, Italy","December 1, 2020",2018,TV-Y,1 Season,Kids' TV,Four friends become guardians of the island Gorm and must harness powers of the elements to stop an evil lord and his army from ruling the kingdom.
s2517,Movie,Grand-Daddy Day Care,Ron Oliver,"Danny Trejo, Reno Wilson, Margaret Avery, Barry Bostwick, Julia Duffy, Anthony Gonzalez, Linda Gray, James Hong, Hal Linden, Alec Mapa",United States,"December 25, 2019",2019,PG-13,96 min,"Children & Family Movies, Comedies",A frustrated novelist with money problems opens an unsanctioned senior center at his house to make quick cash and occupy his cumbersome father-in-law.
s2528,Movie,Greater,David Hunt,"Neal McDonough, Leslie Easterbrook, Christopher Severio, Michael Parks, Nick Searcy, Peter Gray Lewis, Fredric Lehne, M.C. Gainey, Texas Battle, Josh Emerson",United States,"March 31, 2020",2016,PG,131 min,"Children & Family Movies, Dramas, Sports Movies",Faith and determination transform a talentless football player at the University of Arkansas into an All-American in this inspiring true story.
s2531,TV Show,Green Eggs and Ham,NA,"Michael Douglas, Adam Devine, Keegan-Michael Key, Eddie Izzard, Jillian Bell, Ilana Glazer, Diane Keaton, Jeffrey Wright, John Turturro, Tracy Morgan, Daveed Diggs","United Kingdom, Canada, United States","November 8, 2019",2019,TV-Y7,1 Season,"Kids' TV, TV Action & Adventure, TV Comedies","On a road trip to save an endangered animal, polar opposites Guy and Sam learn to try new things like friendship – and a certain delectable dish."
s2535,TV Show,Greenhouse Academy,NA,"Ariel Mortman, Finn Roberts, Chris O'Neal, Dallas Hart, Cinthya Carmona, Grace Van Dien, Benjamin Papac, Jessica Amlee, BJ Mitchell, Aviv Buchler, Nadine Ellis, Yiftach Mizrahi, Parker Stevenson, Ishai Golan, Selina Giles, Reina Hardesty",United States,"March 20, 2020",2020,TV-PG,4 Seasons,"Kids' TV, TV Dramas, Teen TV Shows","When teen siblings Hayley and Alex enter an elite boarding school, they find rivalry, romance and a mystery related to the recent loss of their mom."
s2544,TV Show,Grizzy et les Lemmings,NA,"Pierre-Alain de Garrigues, Josselin Charier",France,"December 12, 2020",2018,TV-Y,2 Seasons,"Kids' TV, TV Comedies","Strong, whip-smart Grizzy rules a Canadian forest, where he has his paws full with a family of frolicsome lemmings."
s2546,Movie,Growing Up Wild,Keith Scholey,Daveed Diggs,United States,"February 19, 2017",2016,G,78 min,"Children & Family Movies, Documentaries","Five baby animals from different parts of the world grow up learning to survive in the wild, nurtured by the love and guidance of their families."
s2560,TV Show,Guru Aur Bhole,NA,Amit Kumar,NA,"March 1, 2019",2018,TV-Y7,3 Seasons,"Kids' TV, TV Comedies",A singer and a dancer who are best friends use their artistic abilities to get out of one hilariously sticky situation after another.
s2568,TV Show,H2O: Just Add Water,NA,"Cariba Heine, Phoebe Tonkin, Angus McLaren, Burgess Abernethy, Claire Holt, Alan David Lee, Cleo Massey, Jamie Timony",Australia,"October 2, 2020",2009,TV-PG,3 Seasons,"Kids' TV, TV Dramas",The gals in this fantasy series cope with the burden of growing a giant fin and transforming into mermaids whenever they come in contact with water.
s2569,TV Show,H2O: Mermaid Adventures,NA,"Sonja Ball, Holly Gauthier-Frankel, Thor Bishopric, Angela Galuppo","Germany, Australia, France, China","July 15, 2015",2015,TV-Y7,2 Seasons,Kids' TV,Three high school friends who turn into mermaids whenever they touch water have undersea adventures while keeping their new life a secret.
s2579,Movie,Hairspray,Adam Shankman,"Nikki Blonsky, John Travolta, Michelle Pfeiffer, Christopher Walken, Amanda Bynes, James Marsden, Queen Latifah, Zac Efron, Brittany Snow, Allison Janney, Elijah Kelley, Jerry Stiller","United States, United Kingdom, Canada","January 1, 2020",2007,PG,116 min,"Children & Family Movies, Comedies, Music & Musicals","In 1962, ambitious plus-size teen Tracy Turnblad tries to integrate a racially divided Baltimore one Watusi at a time."
s2635,Movie,Harriet the Spy: Blog Wars,Ron Oliver,"Jennifer Stone, Kristin Booth, Wesley Morgan, Doug Murray, Shauna MacDonald, Jason Blicker, Jayne Eastwood, Melinda Shankar, Alexander Conti, Vanessa Morgan","United States, Canada","April 15, 2018",2010,TV-G,87 min,"Children & Family Movies, Comedies",Intrepid writer Harriet Welsch is determined to become the class blogger despite stiff competition from her snooty archrival.
s2636,TV Show,Harry & Bunnie,Ah Loong,NA,Malaysia,"October 15, 2017",2017,TV-Y7,1 Season,"Kids' TV, TV Comedies",A young wannabe magician and his mischievous stage rabbit battle and sabotage each other while putting on shows.
s2641,TV Show,Harvey Street Kids,NA,"Lauren Lapkus, Stephanie Lemelin, Kelly McCreary, Atticus Shaffer, Danny Pudi, Grey Griffin, Utkarsh Ambudkar, Roger Craig Smith",United States,"January 10, 2020",2020,TV-Y7,4 Seasons,"Kids' TV, TV Comedies","Kids rule in a place called Harvey Street, where a trio of girls right wrongs, ice cream is always an option, and every day feels like Saturday."
s2648,TV Show,Hatchimals | Adventures in Hatchtopia,NA,"Sam Vincent, Kira Tozer, Andrea Libman",United States,"July 1, 2019",2018,TV-Y,2 Seasons,Kids' TV,"These fun-loving creatures hatch from their shells and spread friendship, laughter and life lessons in the land of Hatchtopia."
s2653,TV Show,Haunted House,NA,"Jo Hyun-jung, Gim Young-eun, Gim Chae-ha, I So Eun, Choe Jae-ho",NA,"December 1, 2018",2017,TV-G,1 Season,"Kids' TV, Korean TV Shows","With help from a 102-year-old goblin dwelling beneath their haunted apartment building, two siblings deal with ghosts and take on spooky mysteries."
s2684,Movie,Hedgehogs,Huang Jianming,"Anthony Padilla, Ian Hecox, Jenn McAllister, Jon Heder, Chevy Chase","United States, China","April 1, 2019",2016,PG,94 min,Children & Family Movies,"When a hedgehog suffering from memory loss forgets his identity, he ends up on a big city journey with a pigeon to save his habitat from a human threat."
s2685,TV Show,Heidi,NA,"Monique Hore, Sophia Morrison, Peter McAllum, Nicole Shostak, Jamie Croft, Beth Armstrong, Kate Fitzpatrick, Penny Cook, Charlotte Hamlyn, Tess Meyer","France, Australia, Germany","September 1, 2020",2020,TV-Y7,1 Season,Kids' TV,A plucky young orphan sent to live with her grandfather in the mountains discovers wonder and adventure around every corner.
s2686,TV Show,"Heidi, bienvenida a casa",NA,"Chiara Francia, Mercedes Lambre, Victorio D'Alessandro, Mario Guerci, Florencia Benítez, Victoria Ramos",Argentina,"May 15, 2019",2017,TV-Y,1 Season,"Kids' TV, Spanish-Language TV Shows","Inspired by the classic novel, this telenovela follows Heidi, who leaves her happy life in the mountains behind when her aunt takes her to the big city."
s2694,TV Show,Hello Ninja,NA,"Lukas Engel, Zoey Siewert, Sam Vincent, Mayumi Yoshida",United States,"July 10, 2020",2020,TV-Y,3 Seasons,Kids' TV,"BFFs Wesley and Georgie and their silly cat sidekick Pretzel transform into ninjas and enter a magic world, where they solve problems and save the day."
s2700,TV Show,Henry Danger,NA,"Jace Norman, Cooper Barnes, Riele Downs, Sean Ryan Fox, Ella Anderson, Michael D. Cohen",United States,"January 15, 2021",2016,TV-G,3 Seasons,"Kids' TV, TV Comedies","A new part-time job forces Henry Hart to balance two lives, one as a typical teenager and the other as secret superhero sidekick Kid Danger."
s2714,Movie,Hey Arnold! The Jungle Movie,"Raymie Muzquiz, Stu Livingston","Mason Vale Cotton, Benjamin Flores Jr., Francesca Smith, Alfred Molina, Dan Castellaneta, Tress MacNeille, Craig Bartlett, Carlos Alazraqui","United States, South Korea, Japan","November 2, 2019",2017,TV-PG,81 min,"Children & Family Movies, Comedies","When Arnold and his crew win a trip to San Lorenzo, their adventure in the wild forces them to take the same risky path as Arnold's missing parents."
s2742,TV Show,Hilda,NA,"Bella Ramsey, Ameerah Falzon-Ojo, Oliver Nelson, Daisy Haggard, Rasmus Hardiker","United Kingdom, Canada, United States","December 14, 2020",2021,TV-Y7,2 Seasons,Kids' TV,"Fearless, free-spirited Hilda finds new friends, adventure and magical creatures when she leaves her enchanted forest home and journeys to the city."
s2766,TV Show,Hogie the Globehopper,NA,Mae Elliessa,United States,"August 1, 2017",2016,TV-Y,1 Season,Kids' TV,"Hogie and his friends travel the world, exploring far-flung locales like Buenos Aires, Cairo, Hawaii and the Galapagos Islands."
s2773,Movie,Holiday in the Wild,Ernie Barbarash,"Rob Lowe, Kristin Davis, Fezile Mpela, John Owen Lowe, Colin Moss",United States,"November 1, 2019",2019,TV-PG,86 min,"Children & Family Movies, Dramas, Romantic Movies","When her husband abruptly ends their marriage, empty nester Kate embarks on a solo second honeymoon in Africa, finding purpose – and potential romance."
s2774,Movie,Holiday Rush,Leslie Small,"Romany Malco, Sonequa Martin-Green, Darlene Love, Deon Cole, La La Anthony, Deysha Nelson, Amarr M. Wooten, Selena-Marie Alphonse, Andrea-Marie Alphonse",United States,"November 28, 2019",2019,TV-PG,94 min,"Children & Family Movies, Dramas",A widowed radio DJ and his four spoiled kids need to tighten their belts and pull together when their life of luxury turns lean just before Christmas.
s2777,Movie,Holly Star,Michael A. Nickles,"Katlyn Carlson, Brian Muller, Teya Patt, Pamela Chabora",United States,"November 1, 2019",2018,PG,92 min,"Children & Family Movies, Comedies, Romantic Movies","Home for the holidays, a broke puppeteer knows there’s treasure buried somewhere under her town. To find it, all she has to do is die – almost."
s2780,Movie,Holy Expectations,Fernando Ayllón,"Adriana Botina, Fernando Ramos, Isabella Sierra, Joavany Álvarez, Christian López, Omar Murillo, Nelson Polanía, Carlos Barbosa, José Manuel Ospina, Aída Morales",NA,"December 15, 2019",2019,TV-14,89 min,"Children & Family Movies, Comedies, International Movies","With a short life expectancy, a young girl uses faith and her vivid imagination to navigate adversity and create a story that impacts all around her."
