show_id,type,title,director,cast,country,date_added,release_year,rating,duration,genre,description
s3844,Movie,Madagascar: Escape 2 Africa,"Eric Darnell, Tom McGrath","Ben Stiller, Chris Rock, David Schwimmer, Jada Pinkett Smith, Sacha Baron Cohen, Cedric the Entertainer, Andy Richter, Bernie Mac, Alec Baldwin, Sherri Shepherd",United States,"May 1, 2020",2008,PG,91 min,"Children & Family Movies, Comedies","A botched rescue strands Alex the lion and his companions in Africa. Sadly, Alex discovers he has little in common with the locals."
s3852,TV Show,Maggie & Bianca: Fashion Friends,Iginio Straffi,"Emanuela Rei, Giorgia Boni, Sergio Ruggeri, Luca Murphy, Federica Corti, Federico Pedroni, Tiffany Zhou, Sergio Melone",Italy,"March 31, 2019",2017,TV-Y7,1 Season,"Kids' TV, TV Comedies","Originally polar opposites, an American fashion student and the daughter of an industry mogul form an everlasting bond and start a rock band in Milan."
s3857,Movie,Magic Snowflake,Luc Vinciguerra,"Nathan Simony, Benoît Allemane, Vincent Grass, Jean-Claude Donda, Alexis Tomassian, Pascal Sellem, Evelyne Grandjean, Alice Révérend, Kylian Trouillard, Céline Melloul","France, Belgium","December 20, 2015",2013,TV-Y,73 min,Children & Family Movies,Young Nicolas agrees to do Santa's work for one year. But the stress of the job threatens the boy's sense of joy – and Christmas itself.
s3862,Movie,Magnus,Benjamin Ree,Magnus Carlsen,Norway,"February 22, 2017",2016,TV-PG,75 min,"Children & Family Movies, Documentaries, International Movies","This dramatic documentary explores the life and mind of Magnus Carlsen, the charismatic Norwegian prodigy who became world chess champion."
s3881,TV Show,Mako Mermaids: An H2O Adventure,NA,"Lucy Fry, Ivy Latimer, Amy Ruffle, Chai Romruen, Isabel Durant, Allie Bertram, Linda Ngo, Gemma Forsyth, Dominic Deutscher, Kerith Atkinson, Rowan Hills, Brooke Nichole Lee",Australia,"May 28, 2020",2016,TV-G,4 Seasons,"Kids' TV, TV Comedies","This ""H2O"" sequel follows Zac, a boy who accidentally turns into a merman and threatens the existence of three young mermaids who guard Mako Island."
s3888,Movie,Malibu Rescue,Savage Steve Holland,"Ricardo Hurtado, Breanna Yde, Jackie R. Jacobson, Abby Donnelly, Alkoya Brunson, JT Neal, Ian Ziering, Bryana Salaz, Camaron Engels, Jeremy Howard, Jeff Meacham",United States,"May 13, 2019",2019,TV-G,70 min,"Children & Family Movies, Comedies","When a long list of shenanigans lands Tyler in hot water, he’s forced to suit up and spend his summer training for an elite junior lifeguard program."
s3889,Movie,Malibu Rescue: The Next Wave,Savage Steve Holland,"Ricardo Hurtado, Breanna Yde, Jackie R. Jacobson, Abby Donnelly, Alkoya Brunson, Jeff Meacham, Ella Gross, Carlos Sanson, JT Neal, Camaron Engels, Kirrilee Berger",United States,"August 4, 2020",2020,TV-G,71 min,"Children & Family Movies, Comedies","As summer returns to Malibu, Team Flounder takes to the beach to host — and unexpectedly compete in — the International Beachmaster Competition."
s3890,TV Show,Malibu Rescue: The Series,NA,"Ricardo Hurtado, Breanna Yde, Jackie R. Jacobson, Abby Donnelly, Alkoya Brunson, Jeremy Howard, JT Neal, Bryana Salaz, Ian Ziering, Camaron Engels",United States,"June 3, 2019",2019,TV-G,1 Season,"Kids' TV, TV Action & Adventure, TV Comedies","On the heels of Junior Rescue training, Team Flounder returns to brave the beach in a series of thrilling saves and lighthearted laughs."
s3941,Movie,Mariah Carey's Merriest Christmas,James Yukich,"Mariah Carey, Lacey Chabert, Kelsey Grammer, Billy Gardell, Fina Strazza, Kenneth Edmonds, Cameron Mathison, Brennan Elliott",United States,"December 9, 2016",2015,TV-G,38 min,"Children & Family Movies, Music & Musicals","Pop music superstar Mariah Carey hosts this all-star holiday celebration with special guests and a celebrity reading of ""The Night Before Christmas."""
s3962,Movie,Marvel Super Hero Adventures: Frost Fight!,Mitch Schauer,"Mick Wingert, Matthew Mercer, Travis Willingham, Fred Tatasciore, Grey DeLisle, Troy Baker, Antony Del Rio, Trevor Devall, Kevin Michael Richardson, Steve Blum, Jane Singer",United States,"February 24, 2016",2015,PG,74 min,"Children & Family Movies, Sci-Fi & Fantasy","In this Christmas-themed special, Captain America and the Avengers battle Loki and Ymir, who plot to steal Santa Claus' powers and conquer the world."
s3965,Movie,Marvel's Hulk: Where Monsters Dwell,Mitch Schauer,"Fred Tatasciore, Liam O'Brien, Jesse Burch, Edward Bosco, Chiara Zanni, Mike Vaughn, Jon Olson, Matthew Waterson, Zach Callison, Laura Bailey, Hope Levy",United States,"January 4, 2017",2016,PG,75 min,"Children & Family Movies, Sci-Fi & Fantasy","On Halloween, the Hulk and Dr. Strange battle monsters wreaking havoc on New York and uncover an evil plot by Nightmare, ruler of the Dream Dimension."
s3972,Movie,Mary and the Witch's Flower,Hiromasa Yonebayashi,"Ruby Barnhill, Kate Winslet, Jim Broadbent, Ewen Bremner, Lynda Baron, Louis Ashbourne Serkis, Morwenna Banks, Teresa Gallagher, Rasmus Hardiker",Japan,"July 17, 2018",2017,PG,103 min,"Anime Features, Children & Family Movies","Ordinary girl Mary picks an extraordinary flower and travels to Endor College, a school for magic. But its foremost teachers have a sinister plan."
s3974,Movie,Mary Poppins Returns,Rob Marshall,"Emily Blunt, Lin-Manuel Miranda, Ben Whishaw, Emily Mortimer, Pixie Davies, Nathanael Saleh, Joel Dawson, Julie Walters, Meryl Streep, Colin Firth, Dick Van Dyke","United States, United Kingdom","July 9, 2019",2018,PG,131 min,"Children & Family Movies, Music & Musicals","In 1930s London, Michael Banks and his three children get some help turning their topsy-turvy world around when his magical childhood nanny reappears."
s3980,TV Show,Masha and the Bear,NA,"Alina Kukushkina, Boris Kutnevich, Giselle Nieto, Elsie Fisher",Russia,"May 1, 2020",2019,TV-Y,4 Seasons,Kids' TV,"Lively little Masha lives near the forest, where she has many wonderful adventures with her best friend, a bear who used to be in the circus."
s3981,TV Show,Masha's Spooky Stories,NA,NA,"United States, Russia","October 1, 2016",2012,TV-Y,1 Season,Kids' TV,"Masha explains why there's no need to be scared of things like monsters, the dark, going to a new school, thunder and other common childhood fears."
s3982,TV Show,Masha's Tales,NA,NA,NA,"February 1, 2016",2012,TV-Y,1 Season,Kids' TV,"Fairy tales get a funny twist when Masha retells them, because she tends to get the details just a little jumbled up in this animated kids' series."
s4062,Movie,Mi amigo Alexis,Alejandro Fernández Almendras,"Luciano González, Alexis Sánchez, Daniel Muñoz, Ignacia Uribe, Marco Baeza, Manuela Oyarzún, Camilo Carmona, Alejandra Yañez, Lorna Campos, Gustavo Becerra",Chile,"August 30, 2019",2019,TV-PG,102 min,"Children & Family Movies, Comedies, Dramas","When a young soccer fan and his idol forge an unexpected friendship, the connection teaches them both lessons about life and their love of the game."
s4066,TV Show,Mia and Me,NA,"Rosabell Laurenti Sellers, Adrian Moore, Saphia Stoney, Josephine Benini, Andrew Craig, Tajja Isen, Rod Wilson, Linda Ballantyne, Jonathan Wilson, Elizabeth Hanna, Norma Dell'Agnese","Netherlands, Germany, Italy, Canada","January 1, 2020",2017,TV-Y7,2 Seasons,Kids' TV,"A mysterious gift from her late parents sends 12-year-old Mia into an enchanted world of elves, unicorns and an evil queen named Panthea."
s4075,Movie,Middle School: The Worst Years of My Life,Steve Carr,"Griffin Gluck, Lauren Graham, Rob Riggle, Thomas Barbusca, Andrew Daly, Adam Pally, Retta, Efren Ramirez, Isabela Moner, Alexa Nisenson, Jacob Hopkins","United States, Cambodia","March 3, 2019",2016,PG,92 min,"Children & Family Movies, Comedies","At Hills Village Middle School, budding cartoonist Rafe and best pal Leo challenge their uptight principal by breaking every rule in his handbook."
s4082,TV Show,Mighty Express,NA,"Jay Hatton, Zoe Hatz, Meesha Contreras, Dylan Shombing, Tyler Nathan, Leo Orgil, Michela Luci, Ian Ho, Evan Lefeuvre, Annick Obonsawin","United States, Canada","September 22, 2020",2020,TV-Y,1 Season,Kids' TV,Catch a ride with the Mighty Express — a team of trains and their kid friends who overcome trouble on the tracks with quick thinking and teamwork!
s4083,Movie,Mighty Express: A Mighty Christmas,Clint Butler,"Jay Hatton, Zoe Hatz, Meesha Contreras, Dylan Schombing, Tyler Nathan, Leo Orgil, Michela Luci, Ian Ho, Evan Lefeuvre, Annick Obonsawin, Gracen Daly",Canada,"December 5, 2020",2020,TV-Y,26 min,Children & Family Movies,The Mighty Express welcomes a new train and speeds into a snowstorm to deliver Santa’s presents and save Christmas for all the kids in Tracksville.
s4084,TV Show,Mighty Little Bheem,NA,NA,NA,"September 25, 2020",2020,TV-Y,3 Seasons,"Kids' TV, TV Comedies",An innocent toddler’s boundless curiosity – and extraordinary might – lead to mischief and adventure in his small Indian town.
s4085,TV Show,Mighty Little Bheem: Diwali,NA,"Samriddhi Shukla, Nishka Raheja, Arannya Kaur, Shanoor Mirza, Rajesh Kava",India,"October 18, 2019",2019,TV-Y,1 Season,"Kids' TV, TV Comedies","From decorating his home to devouring sweets, join Bheem as he makes merry – and a bit of mischief – while the festival of lights is in full swing."
s4086,TV Show,Mighty Little Bheem: Festival of Colors,NA,"Samruddhi Shukla, Aranya Kaur, Rajesh Kava, Nishka Raheja, Sabina Malik, Shanoor Mirza",India,"March 5, 2020",2020,TV-Y,1 Season,"Kids' TV, TV Comedies","From surprising stage performances to spraying colors with friends, join baby Bheem for all his Holi hijinks during the special spring festival."
s4087,TV Show,Mighty Little Bheem: Kite Festival,NA,"Sumruddhi Shukla, Aranya Kaur, Nishka Raheja",India,"January 8, 2021",2021,TV-Y,1 Season,"Kids' TV, TV Comedies","With winter behind them, Bheem and his townspeople usher in a sunny new season in all their favorite ways during the Makar Sankranti festival."
s4088,TV Show,Mighty Morphin Alien Rangers,NA,"Julia Jordan, Matthew Sakimoto, Sicily Johnson, Michael O'Laskey II, Michael R. Gotto, Justin Timsit, Rajia Baroudi, David Bacon, Jim Gray, Karim Prince, Alan Palmer, Tom Wyner, Barbara Goodson, Robert Axelrod, Kerrigan Mahan",NA,"January 1, 2016",1996,TV-Y7,1 Season,Kids' TV,Visitors arrive from space to help Red Ranger and his squad – temporarily stripped of their powers – fight against Lord Zedd and Rita Repulsa.
s4089,TV Show,Mighty Morphin Power Rangers,NA,"Austin St. John, Thuy Trang, Walter Jones, Amy Jo Johnson, David Yost, Jason David Frank, Johnny Yong Bosch, Karan Ashley, Steve Cardenas, Catherine Sutherland, Paul Schrier, Jason Narvy, David Fielding, Richard Steven Horvitz, Barbara Goodson","United States, Japan","January 1, 2016",2010,TV-Y7,4 Seasons,Kids' TV,"Five average teens are chosen by an intergalactic wizard to become the Power Rangers, who must use their new powers to fight the evil Rita Repulsa."
s4090,Movie,Mighty Raju Rio Calling,"Rajiv Chilaka, Anirban Majumder, Alka Amarkant Dubey",NA,India,"April 1, 2020",2014,TV-Y7,97 min,"Children & Family Movies, Sports Movies","Mighty Raju preps for a new adventure in Rio de Janeiro, where he goes toe-to-toe with rival soccer players, faces capoeira fighters and more."
s4113,TV Show,Minecraft: Story Mode,NA,"Patton Oswalt, Catherine Taber, Sean Astin, Melissa Hutchison, Ashley Johnson, Matthew Mercer, Jim Meskimen, Martha Plimpton, Scott Porter, Brian Posehn, Paul Reubens, Billy West, Dave Fennoy","United States, Sweden","November 27, 2018",2015,TV-PG,1 Season,Kids' TV,"Take control of an adventure set in the Minecraft universe. The future of the world is at stake, and your decisions shape the story – so choose wisely!"
s4114,TV Show,Mini Wolf,NA,NA,France,"September 16, 2018",2014,TV-G,2 Seasons,Kids' TV,Mini-Wolf and his fun-loving pals friends are always on the look out for a new adventure – even if it includes a little bit of mischief.
s4115,TV Show,Miniforce,NA,"Sang-hyun Um, Jeong-hwa Yang, Tae-yeol Jeon, Yong-woo Shin, So-yeong Lee, Wan-kyung Sung, Soyeon, Jin-wook Hong, Yeong-wung Jeong",NA,"June 1, 2017",2016,TV-Y7,1 Season,"Kids' TV, Korean TV Shows",Four animal superheroes called the Miniforce transform into robots to protect small and defenseless creatures from the hands of scheming villains.
s4116,TV Show,Miniforce X,NA,NA,South Korea,"October 1, 2019",2018,TV-Y7,1 Season,"Kids' TV, Korean TV Shows",Zenos wants to use the Earth’s negative energy for his own good – and it's up to Miniforce X to stop this space alien’s evil plans.
s4120,Movie,Miracle,Gavin O'Connor,"Kurt Russell, Patricia Clarkson, Noah Emmerich, Sean McCann, Kenneth Welsh, Eddie Cahill, Patrick O'Brien Demsey, Michael Mantenuto, Nathan West, Kenneth Mitchell, Sam Skoryna, Billy Schneider, Michael Kopsa, Beverley Breuer, Lisa Marie Caruk, Ryan Walter, Nate Miller, Joseph Cure, Scott Johnson, Eric Peter-Kaiser, Bobby Hanson","Canada, United States","June 1, 2018",2004,PG,136 min,"Children & Family Movies, Dramas, Sports Movies",U.S. hockey coach Herb Brooks unites a motley crew of college athletes and turns them into a force to be reckoned with at the 1980 Winter Olympics.
s4122,TV Show,Miraculous: Tales of Ladybug & Cat Noir,Thomas Astruc,"Cristina Vee, Bryce Papenbrook, Keith Silverstein, Mela Lee, Max Mittelman, Carrie Keranen, Stephanie Sheh, André Gordon, Matthew Mercer, Christopher Corey Smith, Philece Sampler, Selah Victor, Marieve Herington, Ben Diskin, Kira Buckland, Erin Fitzgerald, Grant George, Ethan Murray, David Roach, Todd Haberkorn","France, South Korea, Japan","February 1, 2020",2019,TV-Y7,5 Seasons,"Kids' TV, TV Action & Adventure","When Paris is in peril, Marinette becomes Ladybug. Little does she know, her school crush Adrien is actually Cat Noir, another city-saving superhero."
s4124,Movie,Mirai,Mamoru Hosoda,"Moka Kamishiraishi, Haru Kuroki, Gen Hoshino, Kumiko Aso, Mitsuo Yoshihara, Yoshiko Miyazaki, Koji Yakusho, Masaharu Fukuyama",Japan,"June 1, 2020",2018,PG,98 min,"Action & Adventure, Anime Features, Children & Family Movies","Unhappy after his new baby sister displaces him, four-year-old Kun begins meeting people and pets from his family's history in their unique house."
s4126,Movie,Mirror Mirror,Tarsem Singh,"Julia Roberts, Lily Collins, Armie Hammer, Nathan Lane, Mare Winningham, Michael Lerner, Sean Bean, Robert Emms, Danny Woodburn, Martin Klebba, Sebastian Saraceno, Jordan Prentice, Mark Povinelli, Joe Gnoffo, Ronald Lee Clark","United States, Canada","April 24, 2020",2012,PG,106 min,"Children & Family Movies, Comedies",This remake of the classic Grimm tale follows fair-skinned Snow White on a quest to regain her royal throne with help from a team of shady dwarves.
s4130,Movie,Misfit,Erwin van den Eshof,"Djamila, Niek Roozen, Bente Fokkens, Jolijn Henneman, Fenna Ramos, Jill Schirnhofer, Donny Roelvink, Défano Holwijn, Luca Gilliot",Netherlands,"August 3, 2019",2017,TV-14,81 min,"Children & Family Movies, Comedies, International Movies","After living in America for years, a teenage girl moves back to the Netherlands and is quickly singled out as a misfit by the popular clique at school."
s4131,Movie,Misfit 2,Erwin van den Eshof,"Djamila, Niek Roozen, Bente Fokkens, Jolijn Henneman, Fenna Ramos, Jill Schirnhofer, Donny Roelvink, Défano Holwijn",Netherlands,"February 1, 2020",2019,TV-G,82 min,"Children & Family Movies, Comedies, International Movies","When her boyfriend abruptly transfers schools, a gifted musician must pair up with an archrival to battle him in a student music competition."
s4160,Movie,Modest Heroes: Ponoc Short Films Theatre,"Hiromasa Yonebayashi, Yoshiyuki Momose, Akihiko Yamashita","Fumino Kimura, Rio Suzuki, Machiko Ono, Sota Shinohara, Kentaro Sakaguchi, Joe Odagiri, Min Tanaka",Japan,"May 22, 2020",2018,PG,54 min,"Anime Features, Children & Family Movies",Two underwater siblings surviving on their own. A boy with a serious egg allergy. A man invisible to the rest of society. Three short animated tales.
s4168,TV Show,Molang,NA,Bruno Guéraçague,France,"July 1, 2019",2015,TV-Y,1 Season,Kids' TV,"An imaginative, big-hearted bunny and his friend, a shy chick, explore the everyday joys of their pastel-colored world."
s4180,TV Show,MONKART,NA,"Kim Jae-ha, Kwon Ji-hye, Lee Bo-hee, Um Sang-hyun, Jung Yoon-jung, Kim Bo-min, Hong So-young, Hong Bum-ki, Ahn Jang-hyuk",NA,"October 18, 2019",2017,TV-Y7,1 Season,"Kids' TV, Korean TV Shows",Jin and his dragon monster Draka set out on a racing adventure and try to save the kingdom from evil forces.
s4183,Movie,Monkey Up,Robert Vince,"Jonathan Mangum, Erin Allin O'Reilly, Kayden Magnuson, Danny Woodburn, Skylar Astin, John Ratzenberger, David Milchard",Canada,"March 19, 2016",2016,PG,83 min,"Children & Family Movies, Comedies",A talking monkey famous for his TV commercials dreams of breaking into real movies. But first he stumbles upon a brother and sister who need his help.
s4185,Movie,Monster Family,Holger Tappe,"Celia Imrie, Emily Watson, Catherine Tate, Jason Isaacs, Nick Frost, Jessica Brown Findlay","Germany, United Kingdom","April 4, 2018",2017,PG,93 min,Children & Family Movies,A family’s festive Halloween plans take a spooky turn when an evil witch's curse transforms the costumed clan into actual monsters.
s4186,Movie,Monster High 13 Wishes,Steve Sacks,"Erin Fitzgerald, Missi Hale, Marcus Griffin, Celeste Henderson, Evan Smith, Cindy Robinson, Julie Maddalena, Cam Clarke, Jonquil Goode",United States,"March 1, 2018",2013,TV-Y7,73 min,Children & Family Movies,"It's a new school year at Monster High, and the little sister of Clawdeen Wolf, Howleen, is determined to be more fangtastic than ever."
s4187,Movie,"Monster High: Boo York, Boo York",William Lau,"Karen Strassman, Celeste Henderson, Wendee Lee, TJ Smith, America Young, Rachel Staman, Laura Bailey",United States,"September 29, 2015",2015,TV-Y7,72 min,"Children & Family Movies, Music & Musicals",Cleo is invited to a gala in the big city celebrating a magical comet and brings her best friends along. But the sinister Nefera has other plans.
s4189,Movie,Monster High: Escape from Skull Shores,"Steve Ball, Andrew Duncan","Kate Higgins, Debi Derryberry, Salli Saffioti, Evan Smith, Laura Bailey, Audu Paden, Erin Fitzgerald, Cindy Robinson, Ogie Banks, Cam Clarke",United States,"January 1, 2018",2012,TV-Y7,46 min,Children & Family Movies,"A swanky cruise veers off course for Lagoona and her friends when they're left stranded on Skull Shores, an island with a notorious beast."
s4190,Movie,Monster High: Freaky Fusion,"William Lau, Sylvain Blais","Cam Clarke, Audu Paden, Laura Bailey, Cindy Robinson, Erin Fitzgerald, Kate Higgins, Salli Saffioti, Sue Swan, Haviland Stillwell, Paula Rhodes, America Young, Stephanie Sheh, Josey Montana McCoy",United States,"January 30, 2018",2014,TV-Y7,74 min,Children & Family Movies,"When Frankie Stein travels back in time, a teen scientist follows her home into the present and causes a lab accident that creates four new monsters."
s4191,Movie,Monster High: Friday Night Frights,Dustin McKenzie,"Laura Bailey, Ogie Banks, Cam Clarke, Debi Derryberry, Erin Fitzgerald, Kate Higgins, Julie Maddalena, Audu Paden, Cindy Robinson, Salli Saffioti, Evan Smith, America Young",United States,"January 1, 2018",2013,TV-Y7,46 min,Children & Family Movies,"In their bid to win the Skulltimate Roller Maze championship, Monster High loses its star players, Clawd and Deuce, to injury."
s4192,Movie,Monster High: Fright On!,"Victor Dal Chele, Alfred Gimeno","Kate Higgins, Debi Derryberry, Salli Saffioti, Laura Bailey, Yuri Lowenthal, Audu Paden, Cindy Robinson, Erin Fitzgerald, America Young, Ogie Banks",United States,"January 1, 2018",2011,TV-Y7,46 min,Children & Family Movies,"Big changes are afoot at Monster High when administrators announce a merger with two other schools, designed to bring all monsters together."
s4193,Movie,"Monster High: Frights, Camera, Action!",William Lau,"Sue Swan, Kate Higgins, Celeste Henderson, Marcus Griffin, America Young, Karen Strassman, James Horan, Erin Fitzgerald, Laura Bailey, Yeni Alvarez",United States,"January 1, 2018",2014,TV-Y7,74 min,Children & Family Movies,"Draculaura is whisked to Transylvania to be crowned vampire queen, but when she learns she's been duped, the search is on for the true royal heir."
s4194,Movie,Monster High: Ghouls Rule,"Mike Fetterly, Steve Sacks","Laura Bailey, Hank Banks, Cam Clarke, Erin Fitzgerald, Dee Dee Green, Kate Higgins, Andrew Duncan",United States,"March 1, 2018",2012,TV-Y7,71 min,Children & Family Movies,"After learning that monsters and ""Normies"" used to spend Halloween together, Frankie Stein and her pals rally both groups for a frightfully good time."
s4195,Movie,Monster High: Great Scarrier Reef,William Lau,"Larissa Galagher, Kate Higgins, Debi Derryberry, Salli Saffioti, America Young, Evan Smith, Lyndsy Kail, Rachel Staman, Cherami Leigh, Paula Rhodes, Erin Fitzgerald",United States,"October 1, 2017",2016,TV-Y7,72 min,Children & Family Movies,"At a Monster High party, Lagoona and pals are sucked into the reef, where she'll have to come to terms with her flaws and confront an old frenemy."
s4196,Movie,Monster High: Haunted,"Dan Fraga, William Lau",NA,United States,"March 24, 2018",2015,TV-Y7,76 min,Children & Family Movies,"Hearing that their old school is being haunted, Spectra Vondergeist and her pals head back to Monster High to get to the bottom of the scary spookery."
s4197,Movie,Monster High: New Ghoul at School,"Audu Paden, Eric Radomski","Kate Higgins, Salli Saffioti, Debi Derryberry, Laura Bailey, Yuri Lowenthal, Audu Paden, Troy Baker, Erin Fitzgerald",United States,"October 1, 2017",2010,TV-Y7,23 min,Children & Family Movies,"Insecure new student Frankie Stein struggles to fit in at Monster High, where ultra-cool ghoul Cleo De Nile and hunky monster Deuce rule the roost."
s4198,Movie,"Monster High: Scaris, City of Frights","Dustin McKenzie, Andrew Duncan, Audu Paden","Laura Bailey, Cam Clarke, Erin Fitzgerald, Dee Dee Green, Celeste Henderson, Kate Higgins, Jonathan Lipow, Julie Maddalena, Dustin McKenzie, Audu Paden",United States,"July 7, 2015",2013,TV-G,60 min,Children & Family Movies,"When Clawdeen gets a chance to study with a top fashion designer, she and her pals hop on a plane to Scaris, France, the city where screams come true."
s4199,Movie,Monster High: Why Do Ghouls Fall in Love?,"Dustin McKenzie, Steve Sacks","Laura Bailey, Ogie Banks, Cam Clarke, Debi Derryberry, Erin Fitzgerald, Kate Higgins, Jonathan Lipow, Audu Paden, Cindy Robinson, Salli Saffioti, Evan Smith, America Young",United States,"January 1, 2018",2013,TV-Y7,46 min,Children & Family Movies,Draculaura's ghoulfriends have some suspicions about one of her two persistent suitors – but can they stop him before he steals her un-beating heart?
s4200,Movie,Monster House,Gil Kenan,"Mitchel Musso, Sam Lerner, Spencer Locke, Steve Buscemi, Kathleen Turner, Jason Lee, Jon Heder, Maggie Gyllenhaal, Catherine O'Hara, Fred Willard, Nick Cannon, Kevin James",United States,"December 1, 2020",2006,PG,91 min,"Children & Family Movies, Comedies","A trio of friends sets out to expose the terrors of a vacant neighborhood house, which appears to have a craving for people — and a life of its own."
s4201,Movie,Monster Island,Leopoldo Aguilar,"Joey Camen, Fiona Hardingham, Johnny Rose, Katie Leigh, Roger L. Jackson, Wally Wingert, Phillip Vasquez","India, Mexico","December 1, 2017",2017,TV-Y7,81 min,Children & Family Movies,"When a teenager discovers he's not really human, he ventures out to a remote island to explore his roots and confronts a series of wild challenges."
s4202,TV Show,Monster Math Squad,NA,"Julie Sype, Cory Doran, Annick Obonsawin, Jenna Warren",Canada,"May 15, 2020",2012,TV-Y,2 Seasons,Kids' TV,"Max, Lily and Goo love to put their minds together and use their math skills to overcome any obstacle, even ones with two left feet or ten thumbs."
s4227,TV Show,Morphle,NA,NA,Netherlands,"December 17, 2020",2020,TV-Y,2 Seasons,"British TV Shows, Kids' TV","Little Mila turns playtime into a series of fun and educational adventures with her magical pet Morphle, who transforms into anything she dreams up!"
s4238,TV Show,Mother Goose Club,NA,NA,United States,"May 19, 2017",2016,TV-Y,2 Seasons,Kids' TV,Classic nursery rhymes and children's songs get a fresh twist in this high-energy program that helps kids learn as they dance and sing along.
s4241,TV Show,Motown Magic,NA,NA,"Australia, United States","June 28, 2019",2019,TV-Y,2 Seasons,Kids' TV,"Imaginative boy Ben transforms his city by bringing colorful street art to life, armed with a magic paintbrush – and the classic sounds of Motown."
s4242,Movie,Motu Patlu: King of Kings,Suhas Kadav,"Saurav Chakrabarty, Vinay Pathak",India,"July 6, 2017",2016,TV-Y7-FV,109 min,"Children & Family Movies, Comedies","Motu and Patlu want to help a circus lion get back to the jungle. On the way, the three become caught up in an exciting adventure in the forest."
s4248,Movie,Mowgli: Legend of the Jungle,Andy Serkis,"Christian Bale, Cate Blanchett, Benedict Cumberbatch, Naomie Harris, Andy Serkis, Rohan Chand, Peter Mullan, Jack Reynor, Eddie Marsan, Tom Hollander, Louis Ashbourne Serkis, Matthew Rhys, Freida Pinto","United Kingdom, United States","December 7, 2018",2018,PG-13,105 min,"Action & Adventure, Children & Family Movies, Dramas",An orphaned boy raised by animals in the jungle seizes his destiny while confronting a dangerous enemy – and his own human origins.
